product_id,StockCode,Description,category_id
1238,22409,"MONEY BOX BISCUITS DESIGN",1
1239,22420,"LIPSTICK PEN BABY PINK",1
1240,22425,"ENAMEL COLANDER CREAM",1
1241,22458,"CAST IRON HOOK GARDEN FORK",1
1242,22459,"CAST IRON HOOK GARDEN TROWEL",1
1243,22499,"WOODEN UNION JACK BUNTING",1
1244,22503,"CABIN BAG VINTAGE PAISLEY",1
1245,22536,"MAGIC DRAWING SLATE PURDEY",1
1246,22586,"FELTCRAFT HAIRBAND PINK AND BLUE",1
1247,22602,"CHRISTMAS RETROSPOT HEART WOOD",1
1248,22649,"STRAWBERRY FAIRY CAKE TEAPOT",1
1249,22668,"PINK BABY BUNTING",1
1250,22673,"FRENCH GARDEN SIGN BLUE METAL",1
1251,22692,"DOORMAT WELCOME TO OUR HOME",1
1252,22746,"POPPY'S PLAYHOUSE LIVINGROOM ",1
1253,22747,"POPPY'S PLAYHOUSE BATHROOM",1
1254,22756,"LARGE YELLOW BABUSHKA NOTEBOOK ",1
1255,22788,"BROCANTE COAT RACK",1
1256,22831,"WHITE BROCANTE SOAP DISH",1
1257,22841,"ROUND CAKE TIN VINTAGE GREEN",1
1258,22863,"SOAP DISH BROCANTE",1
1259,22870,"NUMBER TILE COTTAGE GARDEN 2",1
1260,22890,"NOVELTY BISCUITS CAKE STAND 3 TIER",1
1261,22897,"OVEN MITT APPLES DESIGN",1
1262,22898,"CHILDRENS APRON APPLES DESIGN",1
1263,22944,"CHRISTMAS METAL POSTCARD WITH BELLS",1
1264,22977,"DOLLY GIRL CHILDRENS EGG CUP",1
1265,35637A,"IVORY STRING CURTAIN WITH POLE ",1
1266,35916B,"BLUE FELT HANGING HEART W FLOWER",1
1267,35916C,"PINK FELT HANGING HEART W FLOWER",1
1268,35964,"FOLKART CLIP ON STARS",1
1269,35965,"FOLKART HEART NAPKIN RINGS",1
1270,35967,"FOLK ART METAL STAR T-LIGHT HOLDER",1
1271,37450,"CERAMIC CAKE BOWL + HANGING CAKES",1
1272,37491A,"YELLOW/PINK CERAMIC CANDLE HOLDER",1
1273,46775D,"SUNSET COLOUR CHUNKY KNITTED THROW",1
1274,46776B,"WOVEN BERRIES CUSHION COVER ",1
1275,47566B,"TEA TIME PARTY BUNTING",1
1276,47567B,"TEA TIME KITCHEN APRON",1
1277,47590A,"BLUE HAPPY BIRTHDAY BUNTING",1
1278,47590B,"PINK HAPPY BIRTHDAY BUNTING",1
1279,47594A,"CAROUSEL DESIGN WASHBAG",1
1280,70006,"LOVE HEART POCKET WARMER",1
1281,71496A,"A4 WALL TIDY BLUE OFFICE",1
1282,72134,"COLUMBIAN  CUBE CANDLE ",1
1283,79067,"CORONA MEXICAN TRAY",1
1284,82582,"AREA PATROLLED METAL SIGN",1
1285,82599,"FANNY'S REST STOPMETAL SIGN",1
1286,82616C,"MIDNIGHT GLAMOUR SCARF KNITTING KIT",1
1287,84459B,"YELLOW METAL CHICKEN HEART ",1
1288,84520B,"PACK 20 ENGLISH ROSE PAPER NAPKINS",1
1289,84559A,"3D SHEET OF DOG STICKERS",1
1290,84559B,"3D SHEET OF CAT STICKERS",1
1291,84596J,"MIXED NUTS LIGHT GREEN BOWL",1
1292,84609,"TALL ROCOCO CANDLE HOLDER",1
1293,84659A,"WHITE TRAVEL ALARM CLOCK",1
1294,84663A,"GRASS HOPPER WOODEN WALL CLOCK ",1
1295,84828,"JUNGLE POPSICLES ICE LOLLY HOLDERS",1
1296,84856L,"LARGE TAHITI BEACH BAG",1
1297,84915,"HAND TOWEL PINK FLOWER AND DAISY",1
1298,84950,"ASSORTED COLOUR T-LIGHT HOLDER",1
1299,84976,"RECTANGULAR SHAPED MIRROR",1
1300,85008,"SET OF 3 CONEY ISLAND OVAL BOXES",1
1301,85040B,"SET/4 BLUE FLOWER CANDLES IN BOWL",1
1302,85053,"FRENCH ENAMEL CANDLEHOLDER",1
1303,85114A,"BLACK ENCHANTED FOREST PLACEMAT",1
1304,85131D,"BEADED CRYSTAL HEART PINK ON STICK",1
1305,85170D,"SET/6 PINK BIRD T-LIGHT CANDLES",1
1306,85212,"MINI PAINTED GARDEN DECORATION ",1
1307,85227,"SET OF 6 3D KIT CARDS FOR KIDS",1
1308,85232D,"SET/3 DECOUPAGE STACKING TINS",1
1309,90013B,"BLACK VINTAGE EARRINGS",1
1310,90018B,"GOLD M.O.P ORBIT DROP EARRINGS",1
1311,90019B,"GOLD M.O.P ORBIT BRACELET",1
1312,90024C,"NEW BAROQUE B'FLY NECKLACE GREEN",1
1313,90036F,"FLOWER GLASS GARLD NECKL36"TURQUOIS"",1
1314,90040B,"MURANO STYLE GLASS BRACELET BLACK",1
1315,90051,"CRACKED GLAZE NECKLACE RED",1
1316,90054,"CRACKED GLAZE EARRINGS RED",1
1317,90077,"BLACK DIAMOND CLUSTER EARRINGS",1
1318,90124B,"BLUE MURANO TWIST NECKLACE",1
1319,90134,"OLD ROSE COMBO BEAD NECKLACE",1
1320,90138,"WHITE/PINK MINI CRYSTALS NECKLACE",1
1321,90161B,"ANT COPPER TURQ BOUDICCA BRACELET",1
1322,90166,"PINK & WHITE ROSEBUD RING",1
1323,90173,"PAIR BUTTERFLY HAIR CLIPS",1
1324,90177C,"DROP DIAMANTE EARRINGS CRYSTAL",1
1325,90177E,"DROP DIAMANTE EARRINGS GREEN",1
1326,90181B,"AMETHYST GLASS/SHELL/PEARL NECKLACE",1
1327,90192,"JADE DROP EARRINGS W FILIGREE",1
1328,90206C,"CRYSTAL DIAMANTE STAR BROOCH",1
1329,90209C,"PINK ENAMEL+GLASS HAIR COMB",1
1330,90211A,"DIAMOND LAS VEGAS NECKLACE 45CM",1
1331,90214A,"LETTER "A"" BLING KEY RING"",1
1332,90214E,"LETTER "E"" BLING KEY RING"",1
1333,20970,"PINK FLORAL FELTCRAFT SHOULDER BAG",1
1334,84658,"WHITE STITCHED CUSHION COVER",1
1335,22448,"PIN CUSHION BABUSHKA RED",1
1336,22447,"PIN CUSHION BABUSHKA BLUE",1
1337,22446,"PIN CUSHION BABUSHKA PINK",1
1338,20665,"RED RETROSPOT PURSE ",1
1339,21472,"LADYBIRD + BEE RAFFIA FOOD COVER",1
1340,21877,"HOME SWEET HOME MUG",1
1341,22524,"CHILDRENS GARDEN GLOVES BLUE",1
1342,20765,"CHRYSANTHEMUM SKETCHBOOK ",1
1343,21624,"VINTAGE UNION JACK DOORSTOP",1
1344,84926A,"WAKE UP COCKEREL TILE COASTER",1
1345,85035C,"ROSE 3 WICK MORRIS BOX CANDLE",1
1346,72803A,"ROSE SCENT CANDLE JEWELLED DRAWER",1
1347,40001,"WHITE BAMBOO RIBS LAMPSHADE",1
1348,21709,"FOLDING UMBRELLA CHOCOLATE POLKADOT",1
1349,22220,"CAKE STAND LOVEBIRD 2 TIER WHITE",1
1350,85034A,"3 GARDENIA MORRIS BOXED CANDLES",1
1351,72798C,"SET/4 GARDEN ROSE DINNER CANDLE",1
1352,35271S,"GOLD PRINT PAPER BAG",1
1353,21380,"WOODEN HAPPY BIRTHDAY GARLAND",1
1354,21221,"SET/4 BADGES CUTE CREATURES",1
1355,20755,"BLUE PAISLEY POCKET BOOK",1
1356,21421,"PORCELAIN ROSE LARGE ",1
1357,21422,"PORCELAIN ROSE SMALL",1
1358,22617,"BAKING SET SPACEBOY DESIGN",1
1359,21364,"PEACE SMALL WOOD LETTERS",1
1360,21042,"RED RETROSPOT APRON ",1
1361,22272,"FELTCRAFT DOLL MARIA",1
1362,21172,"PARTY METAL SIGN ",1
1363,72760B,"VINTAGE CREAM 3 BASKET CAKE STAND",1
1364,22365,"DOORMAT RESPECTABLE HOUSE",1
1365,22507,"MEMO BOARD RETROSPOT  DESIGN",1
1366,62096A,"PINK/YELLOW FLOWERS HANDBAG",1
1367,85071D,"CHARLIE+LOLA MY ROOM DOOR SIGN",1
1368,22044,"CHRISTMAS CARD STACK OF PRESENTS",1
1369,21918,"SET 12 KIDS COLOUR  CHALK STICKS",1
1370,22029,"SPACEBOY BIRTHDAY CARD",1
1371,21360,"JOY LARGE WOOD LETTERS",1
1372,84077,"WORLD WAR 2 GLIDERS ASSTD DESIGNS",1
1373,84792,"ENCHANTED BIRD COATHANGER 5 HOOK",1
1374,85175,"CACTI T-LIGHT CANDLES",1
1375,20893,"HANGING BAUBLE T-LIGHT HOLDER SMALL",1
1376,22440,"BALLOON WATER BOMB PACK OF 35",1
1377,22434,"BALLOON PUMP WITH 10 BALLOONS",1
1378,22564,"ALPHABET STENCIL CRAFT",1
1379,22965,"3 TRADITIONAl BISCUIT CUTTERS  SET",1
1380,21215,"IVORY PAPER CUP CAKE CASES ",1
1381,21058,"PARTY INVITES WOODLAND",1
1382,21060,"PARTY INVITES BALLOON GIRL",1
1383,21719,"LOVELY BONBON STICKER SHEET",1
1384,84826,"ASSTD DESIGN 3D PAPER STICKERS",1
1385,21881,"CUTE CATS TAPE",1
1386,22491,"PACK OF 12 COLOURED PENCILS",1
1387,21355,"TOAST ITS - I LOVE YOU ",1
1388,21518,"BANK ACCOUNT  GREETING  CARD ",1
1389,22023,"EMPIRE BIRTHDAY CARD",1
1390,22027,"TEA PARTY BIRTHDAY CARD",1
1391,22718,"CARD CAT AND TREE ",1
1392,22717,"CARD DOG AND BALL ",1
1393,22028,"PENNY FARTHING BIRTHDAY CARD",1
1394,21669,"BLUE STRIPE CERAMIC DRAWER KNOB",1
1395,21673,"WHITE SPOT BLUE CERAMIC DRAWER KNOB",1
1396,22460,"EMBOSSED GLASS TEALIGHT HOLDER",1
1397,22433,"WATERING CAN GREEN DINOSAUR",1
1398,22431,"WATERING CAN BLUE ELEPHANT",1
1399,84674,"FLYING PIG WATERING CAN",1
1400,22676,"FRENCH BLUE METAL DOOR SIGN 1",1
1401,22672,"FRENCH BATHROOM SIGN BLUE METAL",1
1402,22776,"CAKESTAND, 3 TIER, LOVEHEART",1
1403,22778,"GLASS BELL JAR SMALL",1
1404,22777,"GLASS BELL JAR LARGE",1
1405,22924,"FRIDGE MAGNETS LA VIE EN ROSE",1
1406,22832,"BROCANTE SHELF WITH HOOKS",1
1407,20674,"GREEN POLKADOT BOWL",1
1408,22170,"PICTURE FRAME WOOD TRIPLE PORTRAIT",1
1409,21428,"SET3 BOOK BOX GREEN GINGHAM FLOWER ",1
1410,22840,"ROUND CAKE TIN VINTAGE RED",1
1411,79191C,"RETRO PLASTIC ELEPHANT TRAY",1
1412,47471,"RAINBOW PEGS PHOTO CLIP STRING",1
1413,16046,"TEATIME PEN CASE & PENS",1
1414,22796,"PHOTO FRAME 3 CLASSIC HANGING",1
1415,22733,"3D TRADITIONAL CHRISTMAS STICKERS",1
1416,22559,"SEASIDE FLYING DISC",1
1417,22896,"PEG BAG APPLES DESIGN",1
1418,20967,"GREY FLORAL FELTCRAFT SHOULDER BAG",1
1419,21430,"SET/3 RED GINGHAM ROSE STORAGE BOX",1
1420,22070,"SMALL RED RETROSPOT MUG IN BOX ",1
1421,20983,"12 PENCILS TALL TUBE RED RETROSPOT",1
1422,21527,"RED RETROSPOT TRADITIONAL TEAPOT ",1
1423,21538,"DAIRY MAID  PUDDING BOWL",1
1424,85216,"ASSORTED CAKES FRIDGE MAGNETS",1
1425,22131,"FOOD CONTAINER SET 3 LOVE HEART ",1
1426,21163,"DO NOT TOUCH MY STUFF DOOR HANGER ",1
1427,21161,"KEEP OUT BOYS DOOR HANGER ",1
1428,21159,"MOODY BOY  DOOR HANGER ",1
1429,21390,"FILIGRIS HEART WITH BUTTERFLY",1
1430,22285,"DECORATION HEN ON NEST, HANGING",1
1431,22284,"HEN HOUSE DECORATION",1
1432,21383,"PACK OF 12 STICKY BUNNIES",1
1433,21381,"MINI WOODEN HAPPY BIRTHDAY GARLAND",1
1434,22210,"WOOD STAMP SET BEST WISHES",1
1435,22209,"WOOD STAMP SET HAPPY BIRTHDAY",1
1436,21872,"GLAMOROUS  MUG",1
1437,85035A,"GARDENIA 3 WICK MORRIS BOXED CANDLE",1
1438,22761,"CHEST 7 DRAWER MA CAMPAGNE",1
1439,22385,"JUMBO BAG SPACEBOY DESIGN",1
1440,22374,"AIRLINE BAG VINTAGE JET SET RED",1
1441,21741,"COSY SLIPPER SHOES LARGE GREEN",1
1442,85061W,"WHITE JEWELLED HEART DECORATION",1
1443,40016,"CHINESE DRAGON PAPER LANTERNS",1
1444,22202,"MILK PAN PINK POLKADOT",1
1445,21064,"BOOM BOX SPEAKER BOYS",1
1446,84341B,"SMALL PINK MAGIC CHRISTMAS TREE",1
1447,84509G,"SET OF 4 FAIRY CAKE PLACEMATS ",1
1448,16235,"RECYCLED PENCIL WITH RABBIT ERASER",1
1449,20986,"BLUE CALCULATOR RULER",1
1450,20832,"RED FLOCK LOVE HEART PHOTO FRAME",1
1451,84846A,"SCENTED CANDLE IN DIGITALIS TIN",1
1452,22442,"GROW YOUR OWN FLOWERS SET OF 3",1
1453,21769,"VINTAGE POST OFFICE CABINET",1
1454,20798,"CLEAR MILKSHAKE GLASS",1
1455,22320,"BIRDS MOBILE VINTAGE DESIGN",1
1456,21561,"DINOSAUR LUNCH BOX WITH CUTLERY",1
1457,85132B,"CHARLIE AND LOLA TABLE TINS",1
1458,85132C,"CHARLIE AND LOLA FIGURES TINS",1
1459,22215,"CAKE STAND WHITE TWO TIER LACE",1
1460,20675,"BLUE POLKADOT BOWL",1
1461,21239,"PINK  POLKADOT CUP",1
1462,21987,"PACK OF 6 SKULL PAPER CUPS",1
1463,21988,"PACK OF 6 SKULL PAPER PLATES",1
1464,21989,"PACK OF 20 SKULL PAPER NAPKINS",1
1465,22316,"200 BENDY SKULL STRAWS",1
1466,22332,"SKULLS PARTY BAG + STICKER SET",1
1467,21206,"STRAWBERRY HONEYCOMB  GARLAND ",1
1468,20677,"PINK POLKADOT BOWL",1
1469,22806,"SET OF 6 T-LIGHTS WEDDING CAKE ",1
1470,22893,"MINI CAKE STAND T-LIGHT HOLDER",1
1471,85159A,"BLACK TEA,COFFEE,SUGAR JARS",1
1472,21784,"SHOE SHINE BOX ",1
1473,22849,"BREAD BIN DINER STYLE MINT",1
1474,17090D,"VANILLA INCENSE 40 CONES IN TIN",1
1475,17090A,"LAVENDER INCENSE 40 CONES IN TIN",1
1476,72127,"COLUMBIAN CANDLE ROUND ",1
1477,72133,"COLUMBIAN CANDLE RECTANGLE",1
1478,84763,"ZINC FINISH 15CM PLANTER POTS",1
1479,22450,"SILK PURSE BABUSHKA BLUE",1
1480,10124G,"ARMY CAMO BOOKCOVER TAPE",1
1481,84519B,"CARROT CHARLIE+LOLA COASTER SET",1
1482,22505,"MEMO BOARD COTTAGE DESIGN",1
1483,22514,"CHILDS GARDEN SPADE BLUE",1
1484,21504,"SKULLS GREETING CARD",1
1485,22292,"HANGING CHICK  YELLOW DECORATION",1
1486,21211,"SET OF 72 SKULL PAPER  DOILIES",1
1487,22045,"SPACEBOY GIFT WRAP",1
1488,90175C,"BLUE GLASS CHUNKY CHARM BRACELET",1
1489,90180A,"BLACK+WHITE NECKLACE W TASSEL",1
1490,90178A,"AMBER CHUNKY GLASS+BEAD NECKLACE",1
1491,22986,"GINGHAM ROSE WRAP",1
1492,20984,"12 PENCILS TALL TUBE POSY",1
1493,22436,"12 COLOURED PARTY BALLOONS",1
1494,21465,"PINK FLOWER CROCHET FOOD COVER",1
1495,21470,"FLOWER VINE RAFFIA FOOD COVER",1
1496,16012,"FOOD/DRINK SPONGE STICKERS",1
1497,85025C,"PINK HEART SHAPE PHOTO FRAME",1
1498,21849,"SILVER DIAMANTE PEN IN GIFT BOX",1
1499,85124B,"BLUE JUICY FRUIT PHOTO FRAME",1
1500,85124C,"GREEN JUICY FRUIT PHOTO FRAME",1
1501,20828,"GLITTER BUTTERFLY CLIPS",1
1502,21623,"VINTAGE UNION JACK MEMOBOARD",1
1503,16156S,"WRAP PINK FAIRY CAKES ",1
1504,85049F,"BABY BOOM RIBBONS ",1
1505,22426,"ENAMEL WASH BOWL CREAM",1
1506,90082D,"DIAMANTE BOW BROOCH BLACK COLOUR",1
1507,90082A,"DIAMANTE BOW BROOCH GREEN COLOUR",1
1508,90082B,"DIAMANTE BOW BROOCH RED COLOUR",1
1509,90081A,"LILY BROOCH AMETHYST COLOUR",1
1510,90204,"PAIR OF ENAMEL BUTTERFLY HAIRCLIP",1
1511,90185B,"AMETHYST DIAMANTE EXPANDABLE RING",1
1512,90195A,"PURPLE GEMSTONE BRACELET",1
1513,90195B,"BLACK GEMSTONE BRACELET",1
1514,90196A,"PURPLE GEMSTONE NECKLACE 45CM",1
1515,90199A,"5 STRAND GLASS NECKLACE BLACK",1
1516,90186A,"AMETHYST HOOP EARRING FLORAL LEAF",1
1517,20894,"HANGING BAUBLE T-LIGHT HOLDER LARGE",1
1518,85106,"CUT GLASS HEXAGON T-LIGHT HOLDER",1
1519,21415,"CLAM SHELL SMALL ",1
1520,21416,"CLAM SHELL LARGE",1
1521,21417,"COCKLE SHELL DISH",1
1522,22343,"PARTY PIZZA DISH RED RETROSPOT",1
1523,22474,"SPACEBOY TV DINNER TRAY",1
1524,18097A,"PINK TALL PORCELAIN T-LIGHT HOLDER ",1
1525,18097C,"WHITE TALL PORCELAIN T-LIGHT HOLDER",1
1526,21902,"KEY FOB , FRONT  DOOR ",1
1527,21901,"KEY FOB , BACK DOOR ",1
1528,21948,"SET OF 6 CAKE CHOPSTICKS",1
1529,20759,"CHRYSANTHEMUM POCKET BOOK ",1
1530,20760,"GARDEN PATH POCKET BOOK",1
1531,20757,"RED DAISY POCKET BOOK ",1
1532,85185D,"FROG SOCK PUPPET",1
1533,85185B,"PINK HORSE SOCK PUPPET",1
1534,22439,"6 ROCKET BALLOONS ",1
1535,79164,"BLACK WINE GLASS",1
1536,84683,"CLASSICAL ROSE CANDLESTAND",1
1537,79163,"BLACK CHAMPAGNE GLASS",1
1538,22175,"PINK OWL SOFT TOY",1
1539,21155,"RED RETROSPOT PEG BAG",1
1540,15060B,"FAIRY CAKE DESIGN UMBRELLA",1
1541,22985,"WRAP, BILLBOARD FONTS DESIGN",1
1542,22821,"GIFT BAG PSYCHEDELIC APPLES",1
1543,22705,"WRAP GREEN PEARS ",1
1544,84952C,,1
1545,72801C,"4 ROSE PINK DINNER CANDLES",1
1546,72801D,"4 SKY BLUE DINNER CANDLES",1
1547,21735,"TWO DOOR CURIO CABINET",1
1548,21500,"PINK POLKADOT WRAP ",1
1549,15036,"ASSORTED COLOURS SILK FAN",1
1550,"BANK CHARGES","Bank Charges",1
1551,21539,"RED RETROSPOT BUTTER DISH",1
1552,22341,"LOVE GARLAND PAINTED ZINC ",1
1553,22452,"MEASURING TAPE BABUSHKA PINK",1
1554,21508,"VINTAGE KID DOLLY CARD ",1
1555,21499,"BLUE POLKADOT WRAP",1
1556,84952C,"MIRROR LOVE BIRD T-LIGHT HOLDER",1
1557,84952B,"BLACK LOVE BIRD T-LIGHT HOLDER",1
1558,35001G,"HAND OPEN SHAPE GOLD",1
1559,22264,"FELT FARM ANIMAL WHITE BUNNY ",1
1560,22181,"SNOWSTORM PHOTO FRAME FRIDGE MAGNET",1
1561,21392,"RED POLKADOT PUDDING BOWL",1
1562,21393,"BLUE POLKADOT PUDDING BOWL",1
1563,21268,"VINTAGE BLUE TINSEL REEL",1
1564,85144,"JARDIN ETCHED GLASS BUTTER DISH",1
1565,21025,"SPACE FROG",1
1566,21031,"SPACE CADET BLACK",1
1567,21030,"SPACE CADET RED",1
1568,21026,"SPACE OWL",1
1569,21032,"SPACE CADET WHITE",1
1570,21578,"WOODLAND DESIGN  COTTON TOTE BAG",1
1571,21357,"TOAST ITS - DINOSAUR",1
1572,20766,"GARDEN PATH SKETCHBOOK",1
1573,21399,"BLUE POLKADOT COFFEE MUG",1
1574,22562,"MONSTERS STENCIL CRAFT",1
1575,21714,"CITRONELLA CANDLE GARDEN POT",1
1576,20751,"FUNKY WASHING UP GLOVES ASSORTED",1
1577,22636,"CHILDS BREAKFAST SET CIRCUS PARADE",1
1578,21426,"WOODLAND STORAGE BOX SMALL",1
1579,21581,"SKULLS  DESIGN  COTTON TOTE BAG",1
1580,90002D,"FLOWER BURST SILVER RING CRYSTAL",1
1581,21900,"KEY FOB , SHED",1
1582,22031,"BOTANICAL LAVENDER BIRTHDAY CARD",1
1583,22777,"GLASS CLOCHE LARGE",1
1584,21788,"KIDS RAIN MAC BLUE",1
1585,22408,"MONEY BOX CONFECTIONERY DESIGN",1
1586,22406,"MONEY BOX KINGS CHOICE DESIGN",1
1587,22275,"WEEKEND BAG VINTAGE ROSE PAISLEY",1
1588,22042,"CHRISTMAS CARD SINGING ANGEL",1
1589,22089,"PAPER BUNTING VINTAGE PAISLEY",1
1590,85066,"CREAM SWEETHEART MINI CHEST",1
1591,21129,"SILVER FISHING GNOME ",1
1592,21059,"PARTY INVITES DINOSAURS",1
1593,22877,"NUMBER TILE COTTAGE GARDEN 9",1
1594,22869,"NUMBER TILE COTTAGE GARDEN 1",1
1595,22878,"NUMBER TILE COTTAGE GARDEN No",1
1596,21240,"BLUE POLKADOT CUP",1
1597,21927,"BLUE/CREAM STRIPE CUSHION COVER ",1
1598,21925,"UNION STRIPE CUSHION COVER ",1
1599,22763,"KEY CABINET MA CAMPAGNE",1
1600,22334,"DINOSAUR PARTY BAG + STICKER SET",1
1601,22655,"VINTAGE RED KITCHEN CABINET",1
1602,22060,"LARGE CAKE STAND HANGING HEARTS",1
1603,22061,"LARGE CAKE STAND  HANGING STRAWBERY",1
1604,21531,"RED RETROSPOT SUGAR JAM BOWL",1
1605,21039,"RED RETROSPOT SHOPPING BAG",1
1606,21157,"RED RETROSPOT WASHBAG",1
1607,16161P,"WRAP ENGLISH ROSE ",1
1608,16161M,"WRAP  PINK FLOCK",1
1609,85214,"TUB 24 PINK FLOWER PEGS",1
1610,72232,"FENG SHUI PILLAR CANDLE",1
1611,84247G,"DECOUPAGE,GREETING CARD,",1
1612,21530,"DAIRY MAID TOASTRACK",1
1613,21528,"DAIRY MAID TRADITIONAL TEAPOT ",1
1614,21114,"LAVENDER SCENTED FABRIC HEART",1
1615,20615,"BLUE POLKADOT PASSPORT COVER",1
1616,47021G,"SET/6 BEAD COASTERS GAUZE BAG GOLD",1
1617,22443,"GROW YOUR OWN HERBS SET OF 3",1
1618,21807,"WHITE CHRISTMAS STAR DECORATION",1
1619,22689,"DOORMAT MERRY CHRISTMAS RED ",1
1620,22591,"CARDHOLDER GINGHAM CHRISTMAS TREE",1
1621,22504,"CABIN BAG VINTAGE RETROSPOT",1
1622,22158,"3 HEARTS HANGING DECORATION RUSTIC",1
1623,22621,"TRADITIONAL KNITTING NANCY",1
1624,79000,"MOROCCAN TEA GLASS",1
1625,85049B,"LUSH GREENS RIBBONS",1
1626,21878,"PACK OF 6 SANDCASTLE FLAGS ASSORTED",1
1627,85131A,"BEADED PEARL HEART WHITE ON STICK",1
1628,20941,"FROG CANDLE",1
1629,21066,"VINTAGE RED MUG",1
1630,21205,"MULTICOLOUR 3D BALLS GARLAND",1
1631,21361,"LOVE LARGE WOOD LETTERS ",1
1632,21876,"POTTERING MUG",1
1633,22167," OVAL WALL MIRROR DIAMANTE ",1
1634,22200,"FRYING PAN PINK POLKADOT",1
1635,22412,"METAL SIGN NEIGHBOURHOOD WITCH ",1
1636,22525,"CHILDRENS GARDEN GLOVES PINK",1
1637,72349b,"SET/6 PURPLE BUTTERFLY T-LIGHTS",1
1638,84872a,"TEATIME FUNKY FLOWER BACKPACK FOR 2",1
1639,10123C,"HEARTS WRAPPING TAPE ",1
1640,10120,"DOGGY RUBBER",1
1641,84006,"MAGIC TREE -PAPER FLOWERS",1
1642,20767,"BLUE PAISLEY JOURNAL ",1
1643,90094,"NECKLACE+BRACELET SET FRUIT SALAD ",1
1644,21882,"SKULLS TAPE",1
1645,20886,"BOX OF 9 PEBBLE CANDLES",1
1646,21945,"STRAWBERRIES  DESIGN FLANNEL ",1
1647,22133,"PINK LOVE HEART SHAPE CUP",1
1648,22456,"NATURAL SLATE CHALKBOARD LARGE ",1
1649,22891,"TEA FOR ONE POLKADOT",1
1650,47566,"PARTY BUNTING",1
1651,20655,"QUEEN OF SKIES LUGGAGE TAG",1
1652,21100,"CHARLIE AND LOLA CHARLOTTE BAG",1
1653,21201,"TROPICAL  HONEYCOMB PAPER GARLAND ",1
1654,21558,"SKULL LUNCH BOX WITH CUTLERY ",1
1655,21865,"PINK UNION JACK  PASSPORT COVER ",1
1656,22132,"RED LOVE HEART SHAPE CUP",1
1657,22166,"WALL MIRROR RECTANGLE DIAMANTE PINK",1
1658,22518,"CHILDS GARDEN BRUSH BLUE",1
1659,22628,"PICNIC BOXES SET OF 3 RETROSPOT ",1
1660,84509c,"SET OF 4 POLKADOT PLACEMATS ",1
1661,85036b,"CHOCOLATE 1 WICK MORRIS BOX CANDLE",1
1662,72803b,"OCEAN SCENT CANDLE JEWELLED DRAWER",1
1663,84993A,"75 GREEN PETIT FOUR CASES",1
1664,84987,"SET OF 36 TEATIME PAPER DOILIES",1
1665,20998,"ROSE DU SUD OVEN GLOVE",1
1666,22702,"BLACK AND WHITE CAT BOWL",1
1667,84925D,"LA PALMIERA WALL THERMOMETER",1
1668,21078,"SET/20 STRAWBERRY PAPER NAPKINS ",1
1669,22105,"MIRROR MOSAIC GOBLET CANDLE HOLDER",1
1670,22163,"HEART STRING MEMO HOLDER HANGING",1
1671,22216,"T-LIGHT HOLDER WHITE LACE",1
1672,22248,"DECORATION  PINK CHICK MAGIC GARDEN",1
1673,22250,"DECORATION  BUTTERFLY  MAGIC GARDEN",1
1674,22251,"BIRDHOUSE DECORATION MAGIC GARDEN",1
1675,22255,"FELT TOADSTOOL  SMALL",1
1676,22288,"HANGING METAL RABBIT DECORATION",1
1677,22363,"GLASS JAR MARMALADE ",1
1678,22395,"PAPERWEIGHT VINTAGE PAISLEY",1
1679,22483,"RED GINGHAM TEDDY BEAR ",1
1680,22546,"MINI JIGSAW PURDEY",1
1681,22609,"PENS ASSORTED SPACEBALL",1
1682,22762,"CUPBOARD 3 DRAWER MA CAMPAGNE",1
1683,22811,"SET OF 6 T-LIGHTS CACTI ",1
1684,22882,"NUMBER TILE VINTAGE FONT 3",1
1685,22884,"NUMBER TILE VINTAGE FONT 5",1
1686,22908,"PACK OF 20 NAPKINS RED APPLES",1
1687,35599B,"BLACK CHRISTMAS TREE 120CM",1
1688,44234,"ASSORTED CIRCULAR MOBILE",1
1689,71143,"SILVER BOOK MARK WITH BEADS",1
1690,72351A,"SET/6 TURQUOISE BUTTERFLY T-LIGHTS",1
1691,75049L,"LARGE CIRCULAR MIRROR MOBILE",1
1692,75131,"METAL TUBE CHIME ON BAMBOO",1
1693,79191B,"RETRO PLASTIC POLKA TRAY",1
1694,82001S,"VINYL RECORD FRAME SILVER",1
1695,84270,"ASSTD DESIGN BUBBLE GUM RING",1
1696,84660C,"PINK STITCHED WALL CLOCK",1
1697,84661B,"BLACK SQUARE TABLE CLOCK",1
1698,84673B,"BLUE FLY SWAT",1
1699,84927A,"WAKE UP COCKEREL TILE HOOK",1
1700,84927F,"PSYCHEDELIC TILE HOOK",1
1701,85025B,"EAU DE NILE HEART SHAPE PHOTO FRAME",1
1702,85054,"FRENCH ENAMEL POT W LID",1
1703,85055,"FRENCH ENAMEL UTENSIL HOLDER",1
1704,85167B,"BLACK GRAND BAROQUE PHOTO FRAME",1
1705,85169A,"IVORY LOVE BIRD CANDLE",1
1706,85169C,"EAU DE NIL LOVE BIRD CANDLE",1
1707,85169D,"PINK LOVE BIRD CANDLE",1
1708,85203,"HANGING WOOD AND FELT BUTTERFLY ",1
1709,90000D,"COPPER/OLIVE GREEN FLOWER NECKLACE",1
1710,90003E,"GREEN PAIR HEART HAIR SLIDES",1
1711,90028,"NEW BAROQUE LARGE NECKLACE BLK/WHIT",1
1712,90060F,"FIRE POLISHED GLASS NECKL GREEN",1
1713,90114,"SUMMER DAISIES BAG CHARM",1
1714,90115,"SUMMER BUTTERFLIES BAG CHARM",1
1715,90120B,"BLUE MURANO TWIST BRACELET",1
1716,90141A,"GREEN PENDANT TRIPLE SHELL NECKLACE",1
1717,90199B,"5 STRAND GLASS NECKLACE AMETHYST",1
1718,90205A,"LARGE MINT DIAMANTE HAIRSLIDE",1
1719,90214B,"LETTER "B"" BLING KEY RING"",1
1720,90214C,"LETTER "C"" BLING KEY RING"",1
1721,90214F,"LETTER "F"" BLING KEY RING"",1
1722,90214I,"LETTER "I"" BLING KEY RING"",1
1723,90214L,"LETTER "L"" BLING KEY RING"",1
1724,90214N,"LETTER "N"" BLING KEY RING"",1
1725,90214Y,"LETTER "Y"" BLING KEY RING"",1
1726,16218,"CARTOON  PENCIL SHARPENERS",1
1727,16225,"RATTLE SNAKE EGGS",1
1728,20686,"DOLLY MIXTURE CHILDREN'S UMBRELLA",1
1729,21200,"MULTICOLOUR HONEYCOMB PAPER GARLAND",1
1730,21051,"RIBBONS PURSE ",1
1731,21112,"SWISS ROLL TOWEL, PINK  SPOTS",1
1732,21219,"SET/4 BADGES BALLOON GIRL",1
1733,21224,"SET/4 SKULL BADGES",1
1734,21261,"GREEN GOOSE FEATHER CHRISTMAS TREE ",1
1735,21263,"GREEN GOOSE FEATHER TREE 60CM",1
1736,21286,"RETROSPOT CANDLE  LARGE",1
1737,21446,"12 RED ROSE PEG PLACE SETTINGS",1
1738,21619,"4 VANILLA BOTANICAL CANDLES",1
1739,21640,"ASSORTED TUTTI FRUTTI  FOB NOTEBOOK",1
1740,21675,"BUTTERFLIES STICKERS",1
1741,21725,"SWEETIES  STICKERS",1
1742,21828,"EIGHT PIECE SNAKE  SET",1
1743,21829,"DINOSAUR KEYRINGS ASSORTED",1
1744,21903,"MAN FLU METAL SIGN",1
1745,21936,"RED RETROSPOT PICNIC BAG",1
1746,22959,"WRAP CHRISTMAS VILLAGE",1
1747,17084R,"ASSORTED INCENSE PACK",1
1748,17091J,"VANILLA INCENSE IN TIN",1
1749,21027,"NINJA RABBIT PINK",1
1750,84539,"KNITTED RABBIT DOLL ",1
1751,90096,"NECKLACE+BRACELET SET BLUE BLOSSOM",1
1752,21095,"SET/6 POSIES PAPER PLATES",1
1753,22734,amazon,1
1754,22139,amazon,1
1755,85018D,"YULETIDE IMAGES S/6 PAPER BOXES",1
1756,22732,"3D VINTAGE CHRISTMAS STICKERS ",1
1757,47503J,"SET/3 FLORAL GARDEN TOOLS IN BAG",1
1758,37464,"ROBOT MUG IN DISPLAY BOX",1
1759,84247N,"PACK/12 BLUE FOLKART CARDS",1
1760,84247K,"FOLK ART GREETING CARD,pack/12",1
1761,22035,"VINTAGE CARAVAN GREETING CARD ",1
1762,21250,"SET OF SKULL WALL STICKERS",1
1763,21677,"HEARTS  STICKERS",1
1764,47504K,"ENGLISH ROSE GARDEN SECATEURS",1
1765,84212,"ASSORTED FLOWER COLOUR "LEIS"""",1
1766,21377,"SMALL CAMPHOR WOOD FIELD  MUSHROOM",1
1767,21379,"CAMPHOR WOOD PORTOBELLO MUSHROOM",1
1768,37489D,"PINK/GREEN FLOWER DESIGN BIG MUG",1
1769,17107D,"FLOWER FAIRY,5 SUMMER B'DRAW LINERS",1
1770,37489B,"BLUE/YELLOW FLOWER DESIGN BIG MUG",1
1771,37489C,"GREEN/BLUE FLOWER DESIGN BIG MUG",1
1772,21932,"SCANDINAVIAN PAISLEY PICNIC BAG",1
1773,21933,"PINK VINTAGE PAISLEY PICNIC BAG",1
1774,37489A,"YELLOW/PINK FLOWER DESIGN BIG MUG",1
1775,22072,"RED RETROSPOT TEA CUP AND SAUCER ",1
1776,21905,"MORE BUTTER METAL SIGN ",1
1777,22414,"DOORMAT NEIGHBOURHOOD WITCH ",1
1778,22116,"METAL SIGN HIS DINNER IS SERVED",1
1779,85130A,"BEADED PEARL HEART WHITE LARGE",1
1780,85129C,"BEADED CRYSTAL HEART BLUE SMALL",1
1781,22246,"GARLAND, MAGIC GARDEN 1.8M",1
1782,84849A,"HELLO SAILOR BLUE SOAP HOLDER",1
1783,22137,"BATHROOM SET LOVE HEART DESIGN",1
1784,85230B,"CINNAMON SCENTED VOTIVE CANDLE",1
1785,85230F,"JASMINE VOTIVE CANDLE",1
1786,22306,"SILVER MUG BONE CHINA TREE OF LIFE",1
1787,20734,"SILVER MINI TAPE MEASURE ",1
1788,20960,"WATERMELON BATH SPONGE",1
1789,35970,"ZINC FOLKART SLEIGH BELLS",1
1790,84849D,"HOT BATHS SOAP HOLDER",1
1791,84507C,"BLUE CIRCLES DESIGN MONKEY DOLL",1
1792,20910,"VINTAGE PHOTO ALBUM PARIS DAYS",1
1793,82616B,"FRAPPUCINO SCARF KNITTING KIT",1
1794,90128B,"BLUE LEAVES AND BEADS PHONE CHARM",1
1795,90196B,"BLACK GEMSTONE NECKLACE 45CM",1
1796,90198B,"VINTAGE ROSE BEAD BRACELET BLACK",1
1797,90152B,"BLUE/GREEN SHELL NECKLACE W PENDANT",1
1798,90151,"SILVER/NATURAL SHELL NECKLACE",1
1799,20661,"BLUE POLKADOT PURSE ",1
1800,20652,"BLUE POLKADOT LUGGAGE TAG ",1
1801,21845,"DAIRY MAID STRIPE MUG",1
1802,22398,"MAGNETS PACK OF 4 SWALLOWS",1
1803,84877D,"BLUE ROUND COMPACT MIRROR",1
1804,20657,"TROPICAL LUGGAGE TAG",1
1805,47422,"ASSORTED MONKEY SUCTION CUP HOOK",1
1806,21642,"ASSORTED TUTTI FRUTTI PEN",1
1807,47503H,"ASS FLORAL PRINT SPIRIT LEVEL ",1
1808,72130,"COLUMBIAN CANDLE ROUND",1
1809,72128,"COLUMBIAN CANDLE ROUND",1
1810,47343A,"FUSCHIA FLOWER PURSE WITH BEADS",1
1811,72802A,"ROSE SCENT CANDLE IN JEWELLED BOX",1
1812,72802B,"OCEAN SCENT CANDLE IN JEWELLED BOX",1
1813,21054,"NURSE'S BAG SOFT TOY",1
1814,22339,"CHRISTMAS TREE PAINTED ZINC ",1
1815,22337,"ANGEL DECORATION PAINTED ZINC ",1
1816,84562A,"PINK/WHITE RIBBED MELAMINE JUG",1
1817,21040,"MODERN VINTAGE COTTON SHOPPING BAG",1
1818,21937,"STRAWBERRY   PICNIC BAG",1
1819,22701,"PINK DOG BOWL",1
1820,22362,"GLASS JAR PEACOCK BATH SALTS",1
1821,82011C,"BATHROOM SCALES FOOTPRINTS IN SAND",1
1822,84865,"NEW BAROQUE BLACK PHOTO ALBUM",1
1823,35951,,1
1824,22712,,1
1825,22028,,1
1826,85067,,1
1827,21421,,1
1828,21414,,1
1829,21653,,1
1830,21651,,1
1831,85126,,1
1832,21814,,1
1833,21692,,1
1834,21648,,1
1835,21172,,1
1836,21161,,1
1837,84534B,,1
1838,22162,,1
1839,21535,,1
1840,35965,,1
1841,21040,,1
1842,37464,,1
1843,21836,,1
1844,47556B,,1
1845,84562A,,1
1846,37474,,1
1847,21807,,1
1848,21011,,1
1849,21287,"SCENTED VELVET LOUNGE CANDLE ",1
1850,79337,"BLUE FLOCK GLASS CANDLEHOLDER",1
1851,85111,"SILVER GLITTER FLOWER VOTIVE HOLDER",1
1852,22307,"GOLD MUG BONE CHINA TREE OF LIFE",1
1853,85078,"SCANDINAVIAN 3 HEARTS NAPKIN RING",1
1854,85034C,"3 ROSE MORRIS BOXED CANDLES",1
1855,84614A,"PINK BAROQUE FLOCK CANDLE HOLDER",1
1856,22509,"SEWING BOX RETROSPOT DESIGN ",1
1857,90145,"SILVER HOOP EARRINGS WITH FLOWER",1
1858,90143,"SILVER BRACELET W PASTEL FLOWER",1
