product_id,StockCode,Description,category_id
1,85123A,"WHITE HANGING HEART T-LIGHT HOLDER",1
2,71053,"WHITE METAL LANTERN",1
3,84406B,"CREAM CUPID HEARTS COAT HANGER",1
4,84029G,"KNITTED UNION FLAG HOT WATER BOTTLE",1
5,84029E,"RED WOOLLY HOTTIE WHITE HEART.",1
6,22752,"SET 7 BABUSHKA NESTING BOXES",1
7,21730,"GLASS STAR FROSTED T-LIGHT HOLDER",1
8,22633,"HAND WARMER UNION JACK",1
9,22632,"HAND WARMER RED POLKA DOT",1
10,84879,"ASSORTED COLOUR BIRD ORNAMENT",1
11,22745,"POPPY'S PLAYHOUSE BEDROOM ",1
12,22748,"POPPY'S PLAYHOUSE KITCHEN",1
13,22749,"FELTCRAFT PRINCESS CHARLOTTE DOLL",1
14,22310,"IVORY KNITTED MUG COSY ",1
15,84969,"BOX OF 6 ASSORTED COLOUR TEASPOONS",1
16,22623,"BOX OF VINTAGE JIGSAW BLOCKS ",1
17,22622,"BOX OF VINTAGE ALPHABET BLOCKS",1
18,21754,"HOME BUILDING BLOCK WORD",1
19,21755,"LOVE BUILDING BLOCK WORD",1
20,21777,"RECIPE BOX WITH METAL HEART",1
21,48187,"DOORMAT NEW ENGLAND",1
22,22960,"JAM MAKING SET WITH JARS",1
23,22913,"RED COAT RACK PARIS FASHION",1
24,22912,"YELLOW COAT RACK PARIS FASHION",1
25,22914,"BLUE COAT RACK PARIS FASHION",1
26,21756,"BATH BUILDING BLOCK WORD",1
27,22728,"ALARM CLOCK BAKELIKE PINK",1
28,22727,"ALARM CLOCK BAKELIKE RED ",1
29,22726,"ALARM CLOCK BAKELIKE GREEN",1
30,21724,"PANDA AND BUNNIES STICKER SHEET",1
31,21883,"STARS GIFT TAPE ",1
32,10002,"INFLATABLE POLITICAL GLOBE ",1
33,21791,"VINTAGE HEADS AND TAILS CARD GAME ",1
34,21035,"SET/2 RED RETROSPOT TEA TOWELS ",1
35,22326,"ROUND SNACK BOXES SET OF4 WOODLAND ",1
36,22629,"SPACEBOY LUNCH BOX ",1
37,22659,"LUNCH BOX I LOVE LONDON",1
38,22631,"CIRCUS PARADE LUNCH BOX ",1
39,22661,"CHARLOTTE BAG DOLLY GIRL DESIGN",1
40,21731,"RED TOADSTOOL LED NIGHT LIGHT",1
41,22900," SET 2 TEA TOWELS I LOVE LONDON ",1
42,21913,"VINTAGE SEASIDE JIGSAW PUZZLES",1
43,22540,"MINI JIGSAW CIRCUS PARADE ",1
44,22544,"MINI JIGSAW SPACEBOY",1
45,22492,"MINI PAINT SET VINTAGE ",1
46,POST,POSTAGE,1
47,22086,"PAPER CHAIN KIT 50'S CHRISTMAS ",1
48,20679,"EDWARDIAN PARASOL RED",1
49,37370,"RETRO COFFEE MUGS ASSORTED",1
50,21871,"SAVE THE PLANET MUG",1
51,21071,"VINTAGE BILLBOARD DRINK ME MUG",1
52,21068,"VINTAGE BILLBOARD LOVE/HATE MUG",1
53,82483,"WOOD 2 DRAWER CABINET WHITE FINISH",1
54,82486,"WOOD S/3 CABINET ANT WHITE FINISH",1
55,82482,"WOODEN PICTURE FRAME WHITE FINISH",1
56,82494L,"WOODEN FRAME ANTIQUE WHITE ",1
57,21258,"VICTORIAN SEWING BOX LARGE",1
58,22114,"HOT WATER BOTTLE TEA AND SYMPATHY",1
59,21733,"RED HANGING HEART T-LIGHT HOLDER",1
60,22386,"JUMBO BAG PINK POLKADOT",1
61,85099C,"JUMBO  BAG BAROQUE BLACK WHITE",1
62,21033,"JUMBO BAG CHARLIE AND LOLA TOYS",1
63,20723,"STRAWBERRY CHARLOTTE BAG",1
64,84997B,"RED 3 PIECE RETROSPOT CUTLERY SET",1
65,84997C,"BLUE 3 PIECE POLKADOT CUTLERY SET",1
66,21094,"SET/6 RED SPOTTY PAPER PLATES",1
67,20725,"LUNCH BAG RED RETROSPOT",1
68,21559,"STRAWBERRY LUNCH BOX WITH CUTLERY",1
69,22352,"LUNCH BOX WITH CUTLERY RETROSPOT ",1
70,21212,"PACK OF 72 RETROSPOT CAKE CASES",1
71,21975,"PACK OF 60 DINOSAUR CAKE CASES",1
72,21977,"PACK OF 60 PINK PAISLEY CAKE CASES",1
73,84991,"60 TEATIME FAIRY CAKE CASES",1
74,84519A,"TOMATO CHARLIE+LOLA COASTER SET",1
75,85183B,"CHARLIE & LOLA WASTEPAPER BIN FLORA",1
76,85071B,"RED CHARLIE+LOLA PERSONAL DOORSIGN",1
77,21931,"JUMBO STORAGE BAG SUKI",1
78,21929,"JUMBO BAG PINK VINTAGE PAISLEY",1
79,22961,"JAM MAKING SET PRINTED",1
80,22139,"RETROSPOT TEA SET CERAMIC 11 PC ",1
81,84854,"GIRLY PINK TOOL SET",1
82,22411,"JUMBO SHOPPER VINTAGE RED PAISLEY",1
83,82567,"AIRLINE LOUNGE,METAL SIGN",1
84,21672,"WHITE SPOT RED CERAMIC DRAWER KNOB",1
85,22774,"RED DRAWER KNOB ACRYLIC EDWARDIAN",1
86,22771,"CLEAR DRAWER KNOB ACRYLIC EDWARDIAN",1
87,71270,"PHOTO CLIP LINE",1
88,22262,"FELT EGG COSY CHICKEN",1
89,22637,"PIGGY BANK RETROSPOT ",1
90,21934,"SKULL SHOULDER BAG",1
91,21169,"YOU'RE CONFUSING ME METAL SIGN ",1
92,21166,"COOK WITH WINE METAL SIGN ",1
93,21175,"GIN + TONIC DIET METAL SIGN",1
94,37444A,"YELLOW BREAKFAST CUP AND SAUCER",1
95,37444C,"PINK BREAKFAST CUP AND SAUCER ",1
96,22083,"PAPER CHAIN KIT RETROSPOT",1
97,84971S,"SMALL HEART FLOWERS HOOK ",1
98,47580,"TEA TIME DES TEA COSY",1
99,22261,"FELT EGG COSY WHITE RABBIT ",1
100,84832,"ZINC WILLIE WINKIE  CANDLE STICK",1
101,22644,"CERAMIC CHERRY CAKE MONEY BANK",1
102,21533,"RETROSPOT LARGE MILK JUG",1
103,21557,"SET OF 6 FUNKY BEAKERS",1
104,15056BL,"EDWARDIAN PARASOL BLACK",1
105,15056N,"EDWARDIAN PARASOL NATURAL",1
106,22646,"CERAMIC STRAWBERRY CAKE MONEY BANK",1
107,22176,"BLUE OWL SOFT TOY",1
108,22438,"BALLOON ART MAKE YOUR OWN FLOWERS",1
109,22778,"GLASS CLOCHE SMALL",1
110,22719,"GUMBALL MONOCHROME COAT RACK",1
111,21523,"DOORMAT FANCY FONT HOME SWEET HOME",1
112,D,Discount,1
113,21912,"VINTAGE SNAKES & LADDERS",1
114,21832,"CHOCOLATE CALCULATOR",1
115,22379,"RECYCLING BAG RETROSPOT ",1
116,22381,"TOY TIDY PINK POLKADOT",1
117,22798,"ANTIQUE GLASS DRESSING TABLE POT",1
118,22926,"IVORY GIANT GARDEN THERMOMETER",1
119,22839,"3 TIER CAKE TIN GREEN AND CREAM",1
120,22838,"3 TIER CAKE TIN RED AND CREAM",1
121,22783,"SET 3 WICKER OVAL BASKETS W LIDS",1
122,35004C,"SET OF 3 COLOURED  FLYING DUCKS",1
123,82484,"WOOD BLACK BOARD ANT WHITE FINISH",1
124,84755,"COLOUR GLASS T-LIGHT HOLDER HANGING",1
125,22464,"HANGING METAL HEART LANTERN",1
126,21324,"HANGING MEDINA LANTERN SMALL",1
127,22457,"NATURAL SLATE HEART CHALKBOARD ",1
128,22469,"HEART OF WICKER SMALL",1
129,22470,"HEART OF WICKER LARGE",1
130,22224,"WHITE LOVEBIRD LANTERN",1
131,21340,"CLASSIC METAL BIRDCAGE PLANT HOLDER",1
132,22189,"CREAM HEART CARD HOLDER",1
133,22427,"ENAMEL FLOWER JUG CREAM",1
134,22428,"ENAMEL FIRE BUCKET CREAM",1
135,22424,"ENAMEL BREAD BIN CREAM",1
136,22663,"JUMBO BAG DOLLY GIRL DESIGN",1
137,85049A,"TRADITIONAL CHRISTMAS RIBBONS",1
138,22168,"ORGANISER WOOD ANTIQUE WHITE ",1
139,22662,"LUNCH BAG DOLLY GIRL DESIGN",1
140,84880,"WHITE WIRE EGG HOLDER",1
141,85099B,"JUMBO BAG RED RETROSPOT",1
142,79321,"CHILLI LIGHTS",1
143,22780,"LIGHT GARLAND BUTTERFILES PINK",1
144,22779,"WOODEN OWLS LIGHT GARLAND ",1
145,22466,"FAIRY TALE COTTAGE NIGHTLIGHT",1
146,21363,"HOME SMALL WOOD LETTERS",1
147,21411,"GINGHAM HEART  DOORSTOP RED",1
148,22318,"FIVE HEART HANGING DECORATION",1
149,22915,"ASSORTED BOTTLE TOP  MAGNETS ",1
150,22922,"FRIDGE MAGNETS US DINER ASSORTED",1
151,22969,"HOMEMADE JAM SCENTED CANDLES",1
152,22923,"FRIDGE MAGNETS LES ENFANTS ASSORTED",1
153,21115,"ROSE CARAVAN DOORSTOP",1
154,22242,"5 HOOK HANGER MAGIC TOADSTOOL",1
155,22941,"CHRISTMAS LIGHTS 10 REINDEER",1
156,21622,"VINTAGE UNION JACK CUSHION COVER",1
157,35004G,"SET OF 3 GOLD FLYING DUCKS",1
158,85014B,"RED RETROSPOT UMBRELLA",1
159,85014A,"BLACK/BLUE POLKADOT UMBRELLA",1
160,22193,"RED DINER WALL CLOCK",1
161,22192,"BLUE DINER WALL CLOCK",1
162,22191,"IVORY DINER WALL CLOCK",1
163,22195,"LARGE HEART MEASURING SPOONS",1
164,22196,"SMALL HEART MEASURING SPOONS",1
165,22962,"JAM JAR WITH PINK LID",1
166,22963,"JAM JAR WITH GREEN LID",1
167,22968,"ROSE COTTAGE KEEPSAKE BOX ",1
168,84970S,"HANGING HEART ZINC T-LIGHT HOLDER",1
169,22910,"PAPER CHAIN KIT VINTAGE CHRISTMAS",1
170,20668,"DISCO BALL CHRISTMAS DECORATION",1
171,22197,"SMALL POPCORN HOLDER",1
172,22198,"LARGE POPCORN HOLDER ",1
173,21080,"SET/20 RED RETROSPOT PAPER NAPKINS ",1
174,21086,"SET/6 RED SPOTTY PAPER CUPS",1
175,21786,"POLKADOT RAIN HAT ",1
176,22654,"DELUXE SEWING KIT ",1
177,21485,"RETROSPOT HEART HOT WATER BOTTLE",1
178,84030E,"ENGLISH ROSE HOT WATER BOTTLE",1
179,22174,"PHOTO CUBE",1
180,22556,"PLASTERS IN TIN CIRCUS PARADE ",1
181,21984,"PACK OF 12 PINK PAISLEY TISSUES ",1
182,21983,"PACK OF 12 BLUE PAISLEY TISSUES ",1
183,21980,"PACK OF 12 RED RETROSPOT TISSUES ",1
184,21484,"CHICK GREY HOT WATER BOTTLE",1
185,22557,"PLASTERS IN TIN VINTAGE PAISLEY ",1
186,22553,"PLASTERS IN TIN SKULLS",1
187,22150,"3 STRIPEY MICE FELTCRAFT",1
188,22619,"SET OF 6 SOLDIER SKITTLES",1
189,21891,"TRADITIONAL WOODEN SKIPPING ROPE",1
190,21889,"WOODEN BOX OF DOMINOES",1
191,22827,"RUSTIC  SEVENTEEN DRAWER SIDEBOARD",1
192,22127,"PARTY CONES CARNIVAL ASSORTED",1
193,22128,"PARTY CONES CANDY ASSORTED",1
194,22502,"PICNIC BASKET WICKER SMALL",1
195,22338,"STAR DECORATION PAINTED ZINC ",1
196,22180,"RETROSPOT LAMP",1
197,21506,"FANCY FONT BIRTHDAY CARD, ",1
198,22866,"HAND WARMER SCOTTY DOG DESIGN",1
199,22865,"HAND WARMER OWL DESIGN",1
200,22632,"HAND WARMER RED RETROSPOT",1
201,22349,"DOG BOWL CHASING BALL DESIGN",1
202,22558,"CLOTHES PEGS RETROSPOT PACK 24 ",1
203,85152,"HAND OVER THE CHOCOLATE   SIGN ",1
204,22652,"TRAVEL SEWING KIT",1
205,22188,"BLACK HEART CARD HOLDER",1
206,21314,"SMALL GLASS HEART TRINKET POT",1
207,22730,"ALARM CLOCK BAKELIKE IVORY",1
208,22729,"ALARM CLOCK BAKELIKE ORANGE",1
209,22867,"HAND WARMER BIRD DESIGN",1
210,22803,"IVORY EMBROIDERED QUILT ",1
211,35004B,"SET OF 3 BLACK FLYING DUCKS",1
212,21844,"RED RETROSPOT MUG",1
213,22468,"BABUSHKA LIGHTS STRING OF 10",1
214,48185,"DOORMAT FAIRY CAKE",1
215,21232,"STRAWBERRY CERAMIC TRINKET BOX",1
216,22064,"PINK DOUGHNUT TRINKET POT ",1
217,22449,"SILK PURSE BABUSHKA PINK",1
218,22835,"HOT WATER BOTTLE I AM SO POORLY",1
219,22112,"CHOCOLATE HOT WATER BOTTLE",1
220,21479,"WHITE SKULL HOT WATER BOTTLE ",1
221,22111,"SCOTTIE DOG HOT WATER BOTTLE",1
222,22110,"BIRD HOUSE HOT WATER BOTTLE",1
223,22098,"BOUDOIR SQUARE TISSUE BOX",1
224,22100,"SKULLS SQUARE TISSUE BOX",1
225,22766,"PHOTO FRAME CORNICE",1
226,22451,"SILK PURSE BABUSHKA RED",1
227,22549,"PICTURE DOMINOES",1
228,84744,"S/6 SEW ON CROCHET FLOWERS",1
229,85049E,"SCANDINAVIAN REDS RIBBONS",1
230,21328,"BALLOONS  WRITING SET ",1
231,17091A,"LAVENDER INCENSE IN TIN",1
232,22473,"TV DINNER TRAY VINTAGE PAISLEY",1
233,84509A,"SET OF 4 ENGLISH ROSE PLACEMATS",1
234,84510A,"SET OF 4 ENGLISH ROSE COASTERS",1
235,22767,"TRIPLE PHOTO FRAME CORNICE ",1
236,22768,"FAMILY PHOTO FRAME CORNICE",1
237,21463,"MIRRORED DISCO BALL ",1
238,21464,"DISCO BALL ROTATOR BATTERY OPERATED",1
239,20820,"SILVER LOOKING MIRROR",1
240,85150,"LADIES & GENTLEMEN METAL SIGN",1
241,22117,"METAL SIGN HER DINNER IS SERVED ",1
242,48129,"DOORMAT TOPIARY",1
243,82580,"BATHROOM METAL SIGN",1
244,82578,"KITCHEN METAL SIGN",1
245,82581,"TOILET METAL SIGN",1
246,22413,"METAL SIGN TAKE IT OR LEAVE IT ",1
247,21907,"I'M ON HOLIDAY METAL SIGN",1
248,22441,"GROW YOUR OWN BASIL IN ENAMEL MUG",1
249,21122,"SET/10 PINK POLKADOT PARTY CANDLES",1
250,22851,"SET 20 NAPKINS FAIRY CAKES DESIGN ",1
251,22810,"SET OF 6 T-LIGHTS SNOWMEN",1
252,22809,"SET OF 6 T-LIGHTS SANTA",1
253,22435,"SET OF 9 HEART SHAPED BALLOONS",1
254,20966,"SANDWICH BATH SPONGE",1
255,20963,"APPLE BATH SPONGE",1
256,20961,"STRAWBERRY BATH SPONGE ",1
257,22068,"BLACK PIRATE TREASURE CHEST",1
258,21743,"STAR PORTABLE TABLE LIGHT ",1
259,21744,"SNOWFLAKE PORTABLE TABLE LIGHT ",1
260,84709B,"PINK OVAL JEWELLED MIRROR",1
261,21592,"RETROSPOT CIGAR BOX MATCHES ",1
262,21587,"COSY HOUR GIANT TUBE MATCHES",1
263,20992,"JAZZ HEARTS PURSE NOTEBOOK",1
264,22804,"CANDLEHOLDER PINK HANGING HEART",1
265,20749,"ASSORTED COLOUR MINI CASES",1
266,22382,"LUNCH BAG SPACEBOY DESIGN ",1
267,20726,"LUNCH BAG WOODLAND",1
268,22384,"LUNCH BAG PINK POLKADOT",1
269,22467,"GUMBALL COAT RACK",1
270,84625C,"BLUE NEW BAROQUE CANDLESTICK CANDLE",1
271,84625A,"PINK NEW BAROQUECANDLESTICK CANDLE",1
272,21108,"FAIRY CAKE FLANNEL ASSORTED COLOUR",1
273,22848,"BREAD BIN DINER STYLE PINK",1
274,47570B,"TEA TIME TABLE CLOTH",1
275,22837,"HOT WATER BOTTLE BABUSHKA ",1
276,22297,"HEART IVORY TRELLIS SMALL",1
277,22772,"PINK DRAWER KNOB ACRYLIC EDWARDIAN",1
278,22773,"GREEN DRAWER KNOB ACRYLIC EDWARDIAN",1
279,22805,"BLUE DRAWER KNOB ACRYLIC EDWARDIAN",1
280,21125,"SET 6 FOOTBALL CELEBRATION CANDLES",1
281,21126,"SET OF 6 GIRLS CELEBRATION CANDLES",1
282,85049C,"ROMANTIC PINKS RIBBONS ",1
283,85049D,"BRIGHT BLUES RIBBONS ",1
284,85049G,"CHOCOLATE BOX RIBBONS ",1
285,21061,"PARTY INVITES FOOTBALL",1
286,21063,"PARTY INVITES JAZZ HEARTS",1
287,21062,"PARTY INVITES SPACEMAN",1
288,84380,"SET OF 3 BUTTERFLY COOKIE CUTTERS",1
289,84378,"SET OF 3 HEART COOKIE CUTTERS",1
290,22964,"3 PIECE SPACEBOY COOKIE CUTTER SET",1
291,21213,"PACK OF 72 SKULL CAKE CASES",1
292,22417,"PACK OF 60 SPACEBOY CAKE CASES",1
293,84992,"72 SWEETHEART FAIRY CAKE CASES",1
294,22383,"LUNCH BAG SUKI  DESIGN ",1
295,20728,"LUNCH BAG CARS BLUE",1
296,20727,"LUNCH BAG  BLACK SKULL.",1
297,22296,"HEART IVORY TRELLIS LARGE",1
298,20914,"SET/5 RED RETROSPOT LID GLASS BOWLS",1
299,22537,"MAGIC DRAWING SLATE DINOSAUR",1
300,22533,"MAGIC DRAWING SLATE BAKE A CAKE ",1
301,20982,"12 PENCILS TALL TUBE SKULLS",1
302,21915,"RED  HARMONICA IN BOX ",1
303,21914,"BLUE HARMONICA IN BOX ",1
304,21544,"SKULLS  WATER TRANSFER TATTOOS ",1
305,22813,"PACK 3 BOXES BIRD PANNETONE ",1
306,84375,"SET OF 20 KIDS COOKIE CUTTERS",1
307,22418,"10 COLOUR SPACEBOY PEN",1
308,22178,"VICTORIAN GLASS HANGING T-LIGHT",1
309,84970L,"SINGLE HEART ZINC T-LIGHT HOLDER",1
310,22465,"HANGING METAL STAR LANTERN",1
311,84949,"SILVER HANGING T-LIGHT HOLDER",1
312,20685,"DOORMAT RED RETROSPOT",1
313,48194,"DOORMAT HEARTS",1
314,22488,"NATURAL SLATE RECTANGLE CHALKBOARD",1
315,22219,"LOVEBIRD HANGING DECORATION WHITE ",1
316,22610,"PENS ASSORTED FUNNY FACE",1
317,22716,"CARD CIRCUS PARADE",1
318,22706,"WRAP COWBOYS  ",1
319,22371,"AIRLINE BAG VINTAGE TOKYO 78",1
320,21210,"SET OF 72 RETROSPOT PAPER  DOILIES",1
321,16237,"SLEEPING CAT ERASERS",1
322,22714,"CARD BIRTHDAY COWBOY",1
323,22812,"PACK 3 BOXES CHRISTMAS PANNETONE",1
324,84347,"ROTATING SILVER ANGELS T-LIGHT HLDR",1
325,22736,"RIBBON REEL MAKING SNOWMEN ",1
326,22620,"4 TRADITIONAL SPINNING TOPS",1
327,21705,"BAG 500g SWIRLY MARBLES",1
328,90199C,"5 STRAND GLASS NECKLACE CRYSTAL",1
329,22785,"SQUARECUSHION COVER PINK UNION FLAG",1
330,22975,"SPACEBOY CHILDRENS EGG CUP",1
331,22972,"CHILDREN'S SPACEBOY MUG",1
332,22568,"FELTCRAFT CUSHION OWL",1
333,85116,"BLACK CANDELABRA T-LIGHT HOLDER",1
334,22664,"TOY TIDY DOLLY GIRL DESIGN",1
335,21609,"SET 12 LAVENDER  BOTANICAL T-LIGHTS",1
336,21866,"UNION JACK FLAG LUGGAGE TAG",1
337,20669,"RED HEART LUGGAGE TAG",1
338,90129F,"RED GLASS TASSLE BAG CHARM",1
339,90210B,"CLEAR ACRYLIC FACETED BANGLE",1
340,21955,"DOORMAT UNION JACK GUNS AND ROSES",1
341,72802C,"VANILLA SCENT CANDLE JEWELLED BOX",1
342,22109,"FULL ENGLISH BREAKFAST PLATE",1
343,22531,"MAGIC DRAWING SLATE CIRCUS PARADE  ",1
344,21811,"CHRISTMAS HANGING HEART WITH BELL",1
345,22183,"CAKE STAND VICTORIAN FILIGREE MED",1
346,21678,"PAISLEY PATTERN  STICKERS",1
347,21676,"FLOWERS  STICKERS",1
348,85169B,"BLACK LOVE BIRD CANDLE",1
349,16238,"PARTY TIME PENCIL ERASERS",1
350,84906,"PINK B'FLY C/COVER W BOBBLES",1
351,21867,"PINK UNION JACK  LUGGAGE TAG",1
352,22075,"6 RIBBONS ELEGANT CHRISTMAS ",1
353,21326,"AGED GLASS SILVER T-LIGHT HOLDER",1
354,21065,"BOOM BOX SPEAKER GIRLS",1
355,22074,"6 RIBBONS SHIMMERING PINKS ",1
356,20713,"JUMBO BAG OWLS",1
357,21116,"OWL DOORSTOP",1
358,21824,"PAINTED METAL STAR WITH HOLLY BELLS",1
359,21823,"PAINTED METAL HEART WITH HOLLY BELL",1
360,22153,"ANGEL DECORATION STARS ON DRESS",1
361,85099F,"JUMBO BAG STRAWBERRY",1
362,20717,"STRAWBERRY SHOPPER BAG",1
363,22328,"ROUND SNACK BOXES SET OF 4 FRUITS ",1
364,22327,"ROUND SNACK BOXES SET OF 4 SKULLS",1
365,22630,"DOLLY GIRL LUNCH BOX",1
366,21245,"GREEN POLKADOT PLATE ",1
367,21244,"BLUE POLKADOT PLATE ",1
368,21242,"RED RETROSPOT PLATE ",1
369,21243,"PINK  POLKADOT PLATE ",1
370,22273,"FELTCRAFT DOLL MOLLY",1
371,22940,"FELTCRAFT CHRISTMAS FAIRY",1
372,22759,"SET OF 3 NOTEBOOKS IN PARCEL",1
373,21880,"RED RETROSPOT TAPE",1
374,21738,"COSY SLIPPER SHOES SMALL  RED ",1
375,22077,"6 RIBBONS RUSTIC CHARM",1
376,21448,"12 DAISY PEGS IN WOOD BOX",1
377,22243,"5 HOOK HANGER RED MAGIC TOADSTOOL",1
378,22141,"CHRISTMAS CRAFT TREE TOP ANGEL",1
379,22144,"CHRISTMAS CRAFT LITTLE FRIENDS",1
380,21739,"COSY SLIPPER SHOES SMALL GREEN",1
381,22271,"FELTCRAFT DOLL ROSIE",1
382,22274,"FELTCRAFT DOLL EMILY",1
383,22751,"FELTCRAFT PRINCESS OLIVIA DOLL",1
384,21034,"REX CASH+CARRY JUMBO SHOPPER",1
385,22570,"FELTCRAFT CUSHION RABBIT",1
386,22569,"FELTCRAFT CUSHION BUTTERFLY",1
387,22902,"TOTE BAG I LOVE LONDON",1
388,21710,"FOLDING UMBRELLA PINKWHITE POLKADOT",1
389,21708,"FOLDING UMBRELLA CREAM POLKADOT",1
390,21711,"FOLDING UMBRELLA WHITE/RED POLKADOT",1
391,22179,"SET 10 LIGHTS NIGHT OWL",1
392,21706,"FOLDING UMBRELLA RED/WHITE POLKADOT",1
393,85184C,"S/4 VALENTINE DECOUPAGE HEART BOX",1
394,22988,"SOLDIERS EGG CUP ",1
395,20750,"RED RETROSPOT MINI CASES",1
396,22139,,1
397,22952,"60 CAKE CASES VINTAGE CHRISTMAS",1
398,22739,"RIBBON REEL CHRISTMAS SOCK BAUBLE",1
399,22738,"RIBBON REEL SNOWY VILLAGE",1
400,22909,"SET OF 20 VINTAGE CHRISTMAS NAPKINS",1
401,35591T,"TURQUOISE CHRISTMAS TREE ",1
402,22186,"RED STAR CARD HOLDER",1
403,22695,"WICKER WREATH SMALL",1
404,22580,"ADVENT CALENDAR GINGHAM SACK",1
405,22147,"FELTCRAFT BUTTERFLY HEARTS",1
406,22130,"PARTY CONE CHRISTMAS DECORATION ",1
407,22694,"WICKER STAR ",1
408,21790,"VINTAGE SNAP CARDS",1
409,22149,"FELTCRAFT 6 FLOWER FRIENDS",1
410,22321,"BIRD DECORATION RED RETROSPOT",1
411,22594,"CHRISTMAS GINGHAM TREE",1
412,22593,"CHRISTMAS GINGHAM STAR",1
413,22595,"CHRISTMAS GINGHAM HEART",1
414,21986,"PACK OF 12 PINK POLKADOT TISSUES",1
415,22750,"FELTCRAFT PRINCESS LOLA DOLL",1
416,22616,"PACK OF 12 LONDON TISSUES ",1
417,22775,"PURPLE DRAWERKNOB ACRYLIC EDWARDIAN",1
418,22899,"CHILDREN'S APRON DOLLY GIRL ",1
419,22367,"CHILDRENS APRON SPACEBOY DESIGN",1
420,22942,"CHRISTMAS LIGHTS 10 SANTAS ",1
421,21976,"PACK OF 60 MUSHROOM CAKE CASES",1
422,22951,"60 CAKE CASES DOLLY GIRL DESIGN",1
423,22834,"HAND WARMER BABUSHKA DESIGN",1
424,21916,"SET 12 RETRO WHITE CHALK STICKS",1
425,22587,"FELTCRAFT HAIRBAND RED AND BLUE",1
426,22566,"FELTCRAFT HAIRBAND PINK AND PURPLE",1
427,22565,"FELTCRAFT HAIRBANDS PINK AND WHITE ",1
428,22472,"TV DINNER TRAY DOLLY GIRL",1
429,22551,"PLASTERS IN TIN SPACEBOY",1
430,22554,"PLASTERS IN TIN WOODLAND ANIMALS",1
431,22534,"MAGIC DRAWING SLATE SPACEBOY ",1
432,22529,"MAGIC DRAWING SLATE GO TO THE FAIR ",1
433,22530,"MAGIC DRAWING SLATE DOLLY GIRL ",1
434,84032B,"CHARLIE + LOLA RED HOT WATER BOTTLE",1
435,85049H,"URBAN BLACK RIBBONS ",1
436,22807,"SET OF 6 T-LIGHTS TOADSTOOLS",1
437,21494,"ROTATING LEAVES T-LIGHT HOLDER",1
438,22938,"CUPCAKE LACE PAPER SET 6",1
439,21892,"TRADITIONAL WOODEN CATCH CUP GAME ",1
440,21890,"S/6 WOODEN SKITTLES IN COTTON BAG",1
441,21718,"RED METAL BEACH SPADE ",1
442,21716,"BOYS VINTAGE TIN SEASIDE BUCKET",1
443,21715,"GIRLS VINTAGE TIN SEASIDE BUCKET",1
444,22113,"GREY HEART HOT WATER BOTTLE",1
445,22358,"KINGS CHOICE TEA CADDY ",1
446,22357,"KINGS CHOICE BISCUIT TIN",1
447,22115,"METAL SIGN EMPIRE TEA",1
448,21481,"FAWN BLUE HOT WATER BOTTLE",1
449,22585,"PACK OF 6 BIRDY GIFT TAGS",1
450,21556,"CERAMIC STRAWBERRY MONEY BOX",1
451,22645,"CERAMIC HEART FAIRY CAKE MONEY BANK",1
452,22650,"CERAMIC PIRATE CHEST MONEY BANK",1
453,22508,"DOORSTOP RETROSPOT HEART",1
454,22511,"RETROSPOT BABUSHKA DOORSTOP",1
455,22829,"SWEETHEART WIRE WALL TIDY",1
456,21154,"RED RETROSPOT OVEN GLOVE ",1
457,17021,"NAMASTE SWAGAT INCENSE",1
458,22059,"CERAMIC STRAWBERRY DESIGN MUG",1
459,84678,"CLASSICAL ROSE SMALL VASE",1
460,85172,"HYACINTH BULB T-LIGHT CANDLES",1
461,22142,"CHRISTMAS CRAFT WHITE FAIRY ",1
462,21591,"COSY HOUR CIGAR BOX MATCHES ",1
463,22480,"RED TEA TOWEL CLASSIC DESIGN",1
464,22294,"HEART FILIGREE DOVE  SMALL",1
465,21156,"RETROSPOT CHILDRENS APRON",1
466,10133,"COLOURING PENCILS BROWN TUBE",1
467,72800E,"4 IVORY DINNER CANDLES SILVER FLOCK",1
468,84836,"ZINC METAL HEART DECORATION",1
469,20774,"GREEN FERN NOTEBOOK",1
470,20773,"BLUE PAISLEY NOTEBOOK",1
471,20777,"CHRYSANTHEMUM NOTEBOOK",1
472,16016,"LARGE CHINESE STYLE SCISSOR",1
473,16014,"SMALL CHINESE STYLE SCISSOR",1
474,21651,"HANGING GLASS ETCHED TEALIGHT",1
475,22618,"COOKING SET RETROSPOT",1
476,21586,"KINGS CHOICE GIANT TUBE MATCHES",1
477,22152,"PLACE SETTING WHITE STAR",1
478,84754,"S/15 SILVER GLASS BAUBLES IN BAG",1
479,22670,"FRENCH WC SIGN BLUE METAL",1
480,84849B,"FAIRY SOAP SOAP HOLDER",1
481,22927,"GREEN GIANT GARDEN THERMOMETER",1
482,22925,"BLUE GIANT GARDEN THERMOMETER",1
483,21259,"VICTORIAN SEWING BOX SMALL ",1
484,21257,"VICTORIAN SEWING BOX MEDIUM",1
485,21121,"SET/10 RED POLKADOT PARTY CANDLES",1
486,82552,"WASHROOM METAL SIGN",1
487,90200B,"BLACK SWEETHEART BRACELET",1
488,90059B,"DIAMANTE HAIR GRIP PACK/2 BLACK DIA",1
489,90185C,"BLACK DIAMANTE EXPANDABLE RING",1
490,90059E,"DIAMANTE HAIR GRIP PACK/2 RUBY",1
491,90059C,"DIAMANTE HAIR GRIP PACK/2 MONTANA",1
492,90200C,"BLUE SWEETHEART BRACELET",1
493,90200D,"PINK SWEETHEART BRACELET",1
494,90200A,"PURPLE SWEETHEART BRACELET",1
495,22737,"RIBBON REEL CHRISTMAS PRESENT ",1
496,21260,"FIRST AID TIN",1
497,22744,"MAKE YOUR OWN MONSOON CARD KIT",1
498,21985,"PACK OF 12 HEARTS DESIGN TISSUES ",1
499,22295,"HEART FILIGREE DOVE LARGE",1
500,16258A,"SWIRLY CIRCULAR RUBBERS IN BAG",1
501,21992,"VINTAGE PAISLEY STATIONERY SET",1
502,21124,"SET/10 BLUE POLKADOT PARTY CANDLES",1
503,22735,"RIBBON REEL SOCKS AND MITTENS",1
504,22945,"CHRISTMAS METAL TAGS ASSORTED ",1
505,21816,"CHRISTMAS TREE T-LIGHT HOLDER",1
506,21815,"STAR  T-LIGHT HOLDER ",1
507,21814,"HEART T-LIGHT HOLDER ",1
508,10125,"MINI FUNKY DESIGN TAPES",1
509,22573,"STAR WOODEN CHRISTMAS DECORATION",1
510,22577,"WOODEN HEART CHRISTMAS SCANDINAVIAN",1
511,22603,"CHRISTMAS RETROSPOT TREE WOOD",1
512,20878,"SET/9 CHRISTMAS T-LIGHTS SCENTED ",1
513,20866,"BLUE ROSE FABRIC MIRROR",1
514,85095,"THREE CANVAS LUGGAGE TAGS",1
515,22333,"RETROSPOT PARTY BAG + STICKER SET",1
516,21584,"RETROSPOT SMALL TUBE MATCHES",1
517,22731,"3D CHRISTMAS STAMPS STICKERS ",1
518,22956,"36 FOIL HEART CAKE CASES",1
519,22582,"PACK OF 6 SWEETIE GIFT BOXES",1
520,85231B,"CINAMMON SET OF 9 T-LIGHTS",1
521,85231G,"ORANGE SCENTED SET/9 T-LIGHTS",1
522,22082,"RIBBON REEL STRIPES DESIGN ",1
523,22500,"SET OF 2 TINS JARDIN DE PROVENCE",1
524,22742,"MAKE YOUR OWN PLAYTIME CARD KIT",1
525,21329,"DINOSAURS  WRITING SET ",1
526,21327,"SKULLS WRITING SET ",1
527,48173C,"DOORMAT BLACK FLOCK ",1
528,72818,"CHRISTMAS DECOUPAGE CANDLE",1
529,22312,"OFFICE MUG WARMER POLKADOT",1
530,21137,"BLACK RECORD COVER FRAME",1
531,22041,"RECORD FRAME 7" SINGLE SIZE "",1
532,20979,"36 PENCILS TUBE RED RETROSPOT",1
533,20977,"36 PENCILS TUBE WOODLAND",1
534,22571,"ROCKING HORSE RED CHRISTMAS ",1
535,22423,"REGENCY CAKESTAND 3 TIER",1
536,21621,"VINTAGE UNION JACK BUNTING",1
537,47563A,"RETRO LONGBOARD IRONING BOARD COVER",1
538,84558A,"3D DOG PICTURE PLAYING CARDS",1
539,21577,"SAVE THE PLANET COTTON TOTE BAG",1
540,22087,"PAPER BUNTING WHITE LACE",1
541,22651,"GENTLEMAN SHIRT REPAIR KIT ",1
542,22713,"CARD I LOVE LONDON ",1
543,21370,"MIRRORED WALL ART FOXY",1
544,21367,"MIRRORED WALL ART GENTS",1
545,22376,"AIRLINE BAG VINTAGE JET SET WHITE",1
546,21895,"POTTING SHED SOW 'N' GROW SET",1
547,22372,"AIRLINE BAG VINTAGE WORLD CHAMPION ",1
548,21190,"PINK HEARTS PAPER GARLAND",1
549,21894,"POTTING SHED SEED ENVELOPES",1
550,70007,"HI TEC ALPINE HAND WARMER",1
551,46000M,"POLYESTER FILLER PAD 45x45cm",1
552,22712,"CARD DOLLY GIRL ",1
553,22983,"CARD BILLBOARD FONT",1
554,22024,"RAINY LADIES BIRTHDAY CARD",1
555,21488,"RED WHITE SCARF  HOT WATER BOTTLE",1
556,22895,"SET OF 2 TEA TOWELS APPLE AND PEARS",1
557,22784,"LANTERN CREAM GAZEBO ",1
558,21441,"BLUE BIRDHOUSE DECORATION",1
559,84947,"ANTIQUE SILVER TEA GLASS ENGRAVED",1
560,22485,"SET OF 2 WOODEN MARKET CRATES",1
561,21794,"CLASSIC FRENCH STYLE BASKET NATURAL",1
562,20707,"CRAZY DAISY HEART DECORATION",1
563,22588,"CARD HOLDER GINGHAM HEART",1
564,21292,"SMALL STRIPES CHOCOLATE GIFT BAG ",1
565,22760,"TRAY, BREAKFAST IN BED",1
566,22107,"PIZZA PLATE IN BOX",1
567,21486,"PINK HEART DOTS HOT WATER BOTTLE",1
568,22151,"PLACE SETTING WHITE HEART",1
569,22643,"SET OF 4 NAPKIN CHARMS LEAVES   ",1
570,22642,"SET OF 4 NAPKIN CHARMS STARS   ",1
571,22604,"SET OF 4 NAPKIN CHARMS CUTLERY",1
572,22099,"CARAVAN SQUARE TISSUE BOX",1
573,22653,"BUTTON BOX ",1
574,22906,"12 MESSAGE CARDS WITH ENVELOPES",1
575,22754,"SMALL RED BABUSHKA NOTEBOOK ",1
576,22919,"HERB MARKER MINT",1
577,22917,"HERB MARKER ROSEMARY",1
578,22920,"HERB MARKER BASIL",1
579,22921,"HERB MARKER CHIVES ",1
580,22918,"HERB MARKER PARSLEY",1
581,22916,"HERB MARKER THYME",1
582,22575,"METAL MERRY CHRISTMAS WREATH",1
583,21804,"WHITE CHRISTMAS GARLAND STARS TREES",1
584,21588,"RETROSPOT GIANT TUBE MATCHES",1
585,22955,"36 FOIL STAR CAKE CASES ",1
586,22583,"PACK OF 6 HANDBAG GIFT BOXES",1
587,22241,"GARLAND WOODEN HAPPY EASTER",1
588,22904,"CALENDAR PAPER CUT DESIGN",1
589,22905,"CALENDAR IN SEASON DESIGN",1
590,22092,"BLUE PAISLEY TISSUE BOX",1
591,22096,"PINK PAISLEY SQUARE TISSUE BOX ",1
592,21358,"TOAST ITS - HAPPY BIRTHDAY",1
593,21123,"SET/10 IVORY POLKADOT PARTY CANDLES",1
594,21427,"SKULLS STORAGE BOX SMALL",1
595,21930,"JUMBO STORAGE BAG SKULLS",1
596,20772,"GARDEN PATH JOURNAL",1
597,71406C,"BLACK ORANGE SQUEEZER",1
598,84985A,"SET OF 72 GREEN PAPER DOILIES",1
599,20754,"RETROSPOT RED WASHING UP GLOVES",1
600,84596E,"SMALL LICORICE DES PINK BOWL",1
601,21111,"SWISS ROLL TOWEL, CHOCOLATE  SPOTS",1
602,22501,"PICNIC BASKET WICKER LARGE",1
603,22854,"CREAM SWEETHEART EGG HOLDER",1
604,84997D,"PINK 3 PIECE POLKADOT CUTLERY SET",1
605,47599A,"PINK PARTY BAGS",1
606,47599B,"BLUE PARTY BAGS ",1
607,20972,"PINK CREAM FELT CRAFT TRINKET BOX ",1
608,21041,"RED RETROSPOT OVEN GLOVE DOUBLE",1
609,21664,"RIDGED GLASS STORAGE JAR CREAM LID",1
610,22907,"PACK OF 20 NAPKINS PANTRY DESIGN",1
611,22776,"SWEETHEART CAKESTAND 3 TIER",1
612,21810,"CHRISTMAS HANGING STAR WITH BELL",1
613,21197,"MULTICOLOUR  CONFETTI IN TUBE",1
614,85035B,"CHOCOLATE 3 WICK MORRIS BOX CANDLE",1
615,84968C,"SET OF 16 VINTAGE PISTACHIO CUTLERY",1
616,21098,"CHRISTMAS TOILET ROLL",1
617,21192,"WHITE BELL HONEYCOMB PAPER ",1
618,72800B," 4 PURPLE FLOCK DINNER CANDLES",1
619,84563A,"PINK & WHITE BREAKFAST TRAY",1
620,47504H,"ENGLISH ROSE SPIRIT LEVEL ",1
621,21742,"LARGE ROUND WICKER PLATTER ",1
622,22481,"BLACK TEA TOWEL CLASSIC DESIGN",1
