product_id,StockCode,Description,category_id
623,22943,"CHRISTMAS LIGHTS 10 VINTAGE BAUBLES",1
624,22699,"ROSES REGENCY TEACUP AND SAUCER ",1
625,22217,"T-LIGHT HOLDER HANGING LACE",1
626,22227,"HANGING HEART MIRROR DECORATION ",1
627,21106,"CREAM SLICE FLANNEL CHOCOLATE SPOT ",1
628,21107,"CREAM SLICE FLANNEL PINK SPOT ",1
629,22697,"GREEN REGENCY TEACUP AND SAUCER",1
630,21826,"EIGHT PIECE DINOSAUR SET",1
631,22548,"HEADS AND TAILS SPORTING FUN",1
632,17164B,"ASS COL SMALL SAND GECKO P'WEIGHT",1
633,22429,"ENAMEL MEASURING JUG CREAM",1
634,20974,"12 PENCILS SMALL TUBE SKULL",1
635,20973,"12 PENCIL SMALL TUBE WOODLAND",1
636,15044B,"BLUE PAPER PARASOL ",1
637,21135,"VICTORIAN  METAL POSTCARD SPRING",1
638,22173,"METAL 4 HOOK HANGER FRENCH CHATEAU",1
639,22626,"BLACK KITCHEN SCALES",1
640,22625,"RED KITCHEN SCALES",1
641,22624,"IVORY KITCHEN SCALES",1
642,84945,"MULTI COLOUR SILVER T-LIGHT HOLDER",1
643,22244,"3 HOOK HANGER MAGIC GARDEN",1
644,47421,"ASSORTED COLOUR LIZARD SUCTION HOOK",1
645,20712,"JUMBO BAG WOODLAND ANIMALS",1
646,22973,"CHILDREN'S CIRCUS PARADE MUG",1
647,84569B,"PACK 3 FIRE ENGINE/CAR PATCHES",1
648,22815,"CARD PSYCHEDELIC APPLES",1
649,85114B,"IVORY ENCHANTED FOREST PLACEMAT",1
650,22584,"PACK OF 6 PANNETONE GIFT BOXES",1
651,22454,"MEASURING TAPE BABUSHKA RED",1
652,85114C,"RED ENCHANTED FOREST PLACEMAT",1
653,22974,"CHILDRENS DOLLY GIRL MUG",1
654,21452,"TOADSTOOL MONEY BOX",1
655,22743,"MAKE YOUR OWN FLOWERPOWER CARD KIT",1
656,22911,"PAPER CHAIN KIT LONDON",1
657,22453,"MEASURING TAPE BABUSHKA BLUE",1
658,22445,"PENCIL CASE LIFE IS BEAUTIFUL",1
659,22607,"WOODEN ROUNDERS GARDEN SET ",1
660,22635,"CHILDS BREAKFAST SET DOLLY GIRL ",1
661,22634,"CHILDS BREAKFAST SET SPACEBOY ",1
662,22222,"CAKE PLATE LOVEBIRD WHITE",1
663,22947,"WOODEN ADVENT CALENDAR RED",1
664,22187,"GREEN CHRISTMAS TREE CARD HOLDER",1
665,22164,"STRING OF STARS CARD HOLDER",1
666,72598,"SET/12 TAPER CANDLES",1
667,22627,"MINT KITCHEN SCALES",1
668,22487,"WHITE WOOD GARDEN PLANT LADDER",1
669,22360,"GLASS JAR ENGLISH CONFECTIONERY",1
670,22364,"GLASS JAR DIGESTIVE BISCUITS",1
671,21657,"MILK BOTTLE WITH GLASS STOPPER ",1
672,22120,"WELCOME  WOODEN BLOCK LETTERS",1
673,21038,"SET/4 MODERN VINTAGE COTTON NAPKINS",1
674,21625,"VINTAGE UNION JACK APRON",1
675,22097,"SWALLOW SQUARE TISSUE BOX",1
676,21179,"NO JUNK MAIL METAL SIGN",1
677,22185,"SLATE TILE NATURAL HANGING",1
678,21662,"VINTAGE GLASS COFFEE CADDY",1
679,85104,"SILVER GLASS T-LIGHT SET",1
680,21654,"RIDGED GLASS FINGER BOWL",1
681,21658,"GLASS  BEURRE DISH",1
682,21519,"GIN & TONIC DIET GREETING CARD ",1
683,22819,"BIRTHDAY CARD, RETRO SPOT",1
684,22704,"WRAP RED APPLES ",1
685,21498,"RED RETROSPOT WRAP ",1
686,22049,"WRAP CHRISTMAS SCREEN PRINT",1
687,21497,"FANCY FONTS BIRTHDAY WRAP",1
688,21333,"CLASSIC WHITE FRAME",1
689,22194,"BLACK DINER WALL CLOCK",1
690,22688,"DOORMAT PEACE ON EARTH BLUE",1
691,84692,"BOX OF 24 COCKTAIL PARASOLS",1
692,22444,"GROW YOUR OWN PLANT IN A CAN ",1
693,22555,"PLASTERS IN TIN STRONGMAN",1
694,22547,"MINI JIGSAW DINOSAUR ",1
695,22543,"MINI JIGSAW BAKE A CAKE ",1
696,22539,"MINI JIGSAW DOLLY GIRL",1
697,22561,"WOODEN SCHOOL COLOURING SET",1
698,22489,"PACK OF 12 TRADITIONAL CRAYONS",1
699,22814,"CARD PARTY GAMES ",1
700,21520,"BOOZE & WOMEN GREETING CARD ",1
701,21982,"PACK OF 12 SUKI TISSUES ",1
702,21981,"PACK OF 12 WOODLAND TISSUES ",1
703,21967,"PACK OF 12 SKULL TISSUES",1
704,22615,"PACK OF 12 CIRCUS PARADE TISSUES ",1
705,22614,"PACK OF 12 SPACEBOY TISSUES",1
706,22095,"LADS ONLY TISSUE BOX",1
707,22094,"RED RETROSPOT TISSUE BOX",1
708,22966,"GINGERBREAD MAN COOKIE CUTTER",1
709,21874,"GIN AND TONIC MUG",1
710,21873,"IF YOU CAN'T STAND THE HEAT MUG",1
711,21870,"I CAN ONLY PLEASE ONE PERSON MUG",1
712,84050,"PINK HEART SHAPE EGG FRYING PAN",1
713,22315,"200 RED + WHITE BENDY STRAWS",1
714,22667,"RECIPE BOX RETROSPOT ",1
715,22666,"RECIPE BOX PANTRY YELLOW DESIGN",1
716,22665,"RECIPE BOX BLUE SKETCHBOOK DESIGN",1
717,22567,"20 DOLLY PEGS RETROSPOT",1
718,82600,"NO SINGING METAL SIGN",1
719,22842,"BISCUIT TIN VINTAGE RED",1
720,22494,"EMERGENCY FIRST AID TIN ",1
721,22740,"POLKADOT PEN",1
722,22825,"DECORATIVE PLANT POT WITH FRIEZE",1
723,22680,"FRENCH BLUE METAL DOOR SIGN 5",1
724,22797,"CHEST OF DRAWERS GINGHAM HEART ",1
725,21843,"RED RETROSPOT CAKE STAND",1
726,22118,"JOY WOODEN BLOCK LETTERS",1
727,22121,"NOEL WOODEN BLOCK LETTERS ",1
728,22119,"PEACE WOODEN BLOCK LETTERS",1
729,22311,"OFFICE MUG WARMER BLACK+SILVER ",1
730,72817,"SET OF 2 CHRISTMAS DECOUPAGE CANDLE",1
731,22277,"COSMETIC BAG VINTAGE ROSE PAISLEY",1
732,20867,"PINK ROSE FABRIC MIRROR",1
733,21688,"SILVER PLATE CANDLE BOWL SMALL",1
734,21694,"SMALL REGAL  SILVER CANDLEPOT ",1
735,22800,"ANTIQUE TALL SWIRLGLASS TRINKET POT",1
736,22801,"ANTIQUE GLASS PEDESTAL BOWL",1
737,22781,"GUMBALL MAGAZINE RACK",1
738,21466,"RED FLOWER CROCHET FOOD COVER",1
739,21467,"CHERRY CROCHET FOOD COVER",1
740,21471,"STRAWBERRY RAFFIA FOOD COVER",1
741,21469,"POLKA DOT RAFFIA FOOD COVER",1
742,21524,"DOORMAT SPOTTY HOME SWEET HOME",1
743,22791,"T-LIGHT GLASS FLUTED ANTIQUE",1
744,21690,"SILVER  CANDLEPOT JARDIN ",1
745,37343,"POLKADOT MUG PINK ",1
746,22088,"PAPER BUNTING COLOURED LACE",1
747,21143,"ANTIQUE GLASS HEART DECORATION ",1
748,84944,"SET OF 6 KASHMIR FOLKART BAUBLES",1
749,22601,"CHRISTMAS RETROSPOT ANGEL WOOD",1
750,22600,"CHRISTMAS RETROSPOT STAR WOOD",1
751,22574,"HEART WOODEN CHRISTMAS DECORATION",1
752,85199L,"LARGE HANGING IVORY & RED WOOD BIRD",1
753,85199S,"SMALL HANGING IVORY/RED WOOD BIRD",1
754,72741,"GRAND CHOCOLATECANDLE",1
755,37495,"FAIRY CAKE BIRTHDAY CANDLE SET",1
756,22171,"3 HOOK PHOTO SHELF ANTIQUE WHITE",1
757,85067,"CREAM SWEETHEART WALL CABINET",1
758,48184,"DOORMAT ENGLISH ROSE ",1
759,48138,"DOORMAT UNION FLAG",1
760,85019A,"ROMANTIC IMAGES NOTEBOOK SET",1
761,85019C,"CURIOUS  IMAGES NOTEBOOK SET",1
762,20902,"VINTAGE KEEPSAKE BOX PARIS DAYS",1
763,21429,"RED GINGHAM ROSE JEWELLERY BOX",1
764,85071A,"BLUE CHARLIE+LOLA PERSONAL DOORSIGN",1
765,85071C,"CHARLIE+LOLA"EXTREMELY BUSY"" SIGN"",1
766,22355,"CHARLOTTE BAG SUKI DESIGN",1
767,21579,"LOLITA  DESIGN  COTTON TOTE BAG",1
768,21576,"LETS GO SHOPPING COTTON TOTE BAG",1
769,22493,"PAINT YOUR OWN CANVAS SET",1
770,21833,"CAMOUFLAGE LED TORCH",1
771,85135B,"BLUE DRAGONFLY HELICOPTER",1
772,85136A,"YELLOW SHARK HELICOPTER",1
773,85136C,"RED SHARK HELICOPTER",1
774,21055,"TOOL BOX SOFT TOY ",1
775,21056,"DOCTOR'S BAG SOFT TOY",1
776,C2,CARRIAGE,1
777,21928,"JUMBO BAG SCANDINAVIAN PAISLEY",1
778,20711,"JUMBO BAG TOYS ",1
779,21773,"DECORATIVE ROSE BATHROOM BOTTLE",1
780,21774,"DECORATIVE CATS BATHROOM BOTTLE",1
781,21787,"RAIN PONCHO RETROSPOT",1
782,21801,"CHRISTMAS TREE DECORATION WITH BELL",1
783,21802,"CHRISTMAS TREE HEART DECORATION",1
784,21803,"CHRISTMAS TREE STAR DECORATION",1
785,21809,"CHRISTMAS HANGING TREE WITH BELL",1
786,21821,"GLITTER STAR GARLAND WITH BELLS ",1
787,21822,"GLITTER CHRISTMAS TREE WITH BELLS",1
788,21851,"LILAC DIAMANTE PEN IN GIFT BOX",1
789,21879,"HEARTS GIFT TAPE",1
790,21884,"CAKES AND BOWS GIFT  TAPE",1
791,21888,"BINGO SET",1
792,21911,"GARDEN METAL SIGN ",1
793,21922,"UNION STRIPE WITH FRINGE  HAMMOCK",1
794,21935,"SUKI  SHOULDER BAG",1
795,21942,"SKULLS DESIGN FLANNEL",1
796,21944,"KITTENS DESIGN FLANNEL",1
797,21949,"SET OF 6 STRAWBERRY CHOPSTICKS",1
798,21990,"MODERN FLORAL STATIONERY SET",1
799,21991,"BOHEMIAN COLLAGE STATIONERY SET",1
800,21993,"FLORAL FOLK STATIONERY SET",1
801,22037,"ROBOT BIRTHDAY CARD",1
802,22043,"CHRISTMAS CARD SCREEN PRINT ",1
803,22065,"CHRISTMAS PUDDING TRINKET POT ",1
804,22067,"CHOC TRUFFLE GOLD TRINKET POT ",1
805,22069,"BROWN  PIRATE TREASURE CHEST ",1
806,22071,"SMALL WHITE RETROSPOT MUG IN BOX ",1
807,22076,"6 RIBBONS EMPIRE  ",1
808,22080,"RIBBON REEL POLKADOTS ",1
809,22081,"RIBBON REEL FLORA + FAUNA ",1
810,22090,"PAPER BUNTING RETROSPOT",1
811,22134,"LADLE LOVE HEART RED ",1
812,22135,"LADLE LOVE HEART PINK",1
813,22154,"ANGEL DECORATION 3 BUTTONS ",1
814,22155,"STAR DECORATION RUSTIC",1
815,22156,"HEART DECORATION WITH PEARLS ",1
816,22161,"HEART DECORATION RUSTIC HANGING ",1
817,22162,"HEART GARLAND RUSTIC PADDED",1
818,22169,"FAMILY ALBUM WHITE PICTURE FRAME",1
819,22182,"CAKE STAND VICTORIAN FILIGREE SMALL",1
820,22190,"LOCAL CAFE MUG",1
821,22203,"MILK PAN RED RETROSPOT",1
822,22207,"FRYING PAN UNION FLAG",1
823,22265,"EASTER DECORATION NATURAL CHICK",1
824,22276,"WASH BAG VINTAGE ROSE PAISLEY",1
825,22299,"PIG KEYRING WITH LIGHT & SOUND ",1
826,22300,"COFFEE MUG DOG + BALL DESIGN",1
827,22301,"COFFEE MUG CAT + BIRD DESIGN",1
828,22309,"TEA COSY RED  STRIPE",1
829,22314,"OFFICE MUG WARMER CHOC+BLUE",1
830,22335,"HEART DECORATION PAINTED ZINC ",1
831,22336,"DOVE DECORATION PAINTED ZINC ",1
832,22345,"PARTY PIZZA DISH BLUE POLKADOT",1
833,22348,"TEA BAG PLATE RED RETROSPOT",1
834,22356,"CHARLOTTE BAG PINK POLKADOT",1
835,22359,"GLASS JAR KINGS CHOICE",1
836,22361,"GLASS JAR DAISY FRESH COTTON WOOL",1
837,22375,"AIRLINE BAG VINTAGE JET SET BROWN",1
838,22378,"WALL TIDY RETROSPOT ",1
839,22380,"TOY TIDY SPACEBOY  ",1
840,22394,"PAPERWEIGHT KINGS CHOICE ",1
841,22396,"MAGNETS PACK OF 4 RETRO PHOTO",1
842,22419,"LIPSTICK PEN RED",1
843,22422,"TOOTHPASTE TUBE PEN",1
844,22430,"ENAMEL WATERING CAN CREAM",1
845,22432,"WATERING CAN PINK BUNNY",1
846,22437,"SET OF 9 BLACK SKULL BALLOONS",1
847,22471,"TV DINNER TRAY AIR HOSTESS ",1
848,22476,"EMPIRE UNION JACK TV DINNER TRAY",1
849,22477,"WATERING CAN GARDEN MARKER",1
850,22478,"BIRDHOUSE GARDEN MARKER ",1
851,22479,"DAISY GARDEN MARKER",1
852,22497,"SET OF 2 TINS VINTAGE BATHROOM ",1
853,22515,"CHILDS GARDEN SPADE PINK",1
854,22517,"CHILDS GARDEN RAKE PINK",1
855,22519,"CHILDS GARDEN BRUSH PINK",1
856,22545,"MINI JIGSAW BUNNIES",1
857,22550,"HOLIDAY FUN LUDO",1
858,22560,"TRADITIONAL MODELLING CLAY",1
859,22589,"CARDHOLDER GINGHAM STAR",1
860,22605,"WOODEN CROQUET GARDEN SET",1
861,22639,"SET OF 4 NAPKIN CHARMS HEARTS",1
862,22669,"RED BABY BUNTING ",1
863,22675,"FRENCH KITCHEN SIGN BLUE METAL",1
864,22734,"SET OF 6 RIBBONS VINTAGE CHRISTMAS",1
865,22741,"FUNKY DIVA PEN",1
866,22755,"SMALL PURPLE BABUSHKA NOTEBOOK ",1
867,22757,"LARGE RED BABUSHKA NOTEBOOK ",1
868,22758,"LARGE PURPLE BABUSHKA NOTEBOOK  ",1
869,22769,"CHALKBOARD KITCHEN ORGANISER",1
870,22792,"FLUTED ANTIQUE CANDLE HOLDER",1
871,22816,"CARD MOTORBIKE SANTA",1
872,22818,"CARD CHRISTMAS VILLAGE",1
873,22822,"CREAM WALL PLANTER HEART SHAPED",1
874,22844,"VINTAGE CREAM DOG FOOD CONTAINER",1
875,22847,"BREAD BIN DINER STYLE IVORY",1
876,22862,"LOVE HEART NAPKIN BOX ",1
877,22876,"NUMBER TILE COTTAGE GARDEN 8",1
878,22928,"YELLOW GIANT GARDEN THERMOMETER",1
879,22948,"METAL DECORATION NAUGHTY CHILDREN ",1
880,22949,"36 DOILIES DOLLY GIRL",1
881,22976,"CIRCUS PARADE CHILDRENS EGG CUP ",1
882,35095A,"BLUE VICTORIAN FABRIC OVAL BOX",1
883,35095B,"RED VICTORIAN FABRIC OVAL BOX",1
884,35471D,"SET OF 3 BIRD LIGHT PINK FEATHER ",1
885,35598D,"PINK/WHITE CHRISTMAS TREE 60CM",1
886,35599D,"PINK AND WHITE CHRISTMAS TREE 120CM",1
887,35610A,"PINK CHRISTMAS FLOCK DROPLET ",1
888,35818P,"ACRYLIC JEWEL ICICLE, PINK",1
889,35957,"SMALLFOLKART BAUBLE CHRISTMAS DEC",1
890,35961,"FOLKART ZINC HEART CHRISTMAS DEC",1
891,35971,"ROSE FOLKART HEART DECORATIONS",1
892,37449,"CERAMIC CAKE STAND + HANGING CAKES",1
893,37476,"CONDIMENT TRAY 4 BOWLS AND 4 SPOONS",1
894,47559B,"TEA TIME OVEN GLOVE",1
895,47591B,"SCOTTIES CHILDRENS APRON",1
896,47591D,"PINK FAIRY CAKE CHILDRENS APRON",1
897,47593B,"SCOTTIE DOGS BABY BIB",1
898,48188,"DOORMAT WELCOME PUPPIES",1
899,71459,"HANGING JAM JAR T-LIGHT HOLDER",1
900,72586,"SET OF 6 HALLOWEEN GHOST T-LIGHTS",1
901,72799E,"IVORY PILLAR CANDLE SILVER FLOCK",1
902,72799F,"IVORY PILLAR CANDLE GOLD FLOCK",1
903,72807A,"SET/3 ROSE CANDLE IN JEWELLED BOX",1
904,72807B,"SET/3 OCEAN SCENT CANDLE JEWEL BOX",1
905,72807C,"SET/3 VANILLA SCENTED CANDLE IN BOX",1
906,72816,"SET/3 CHRISTMAS DECOUPAGE CANDLES",1
907,79030D,"TUMBLER, BAROQUE",1
908,79030G,"TUMBLER, NEW ENGLAND",1
909,82551,"LAUNDRY 15C METAL SIGN",1
910,82583,"HOT BATHS METAL SIGN",1
911,82613B,"METAL SIGN,CUPCAKE SINGLE HOOK",1
912,82613C,"METAL SIGN,CUPCAKE SINGLE HOOK",1
913,82613D,"METAL SIGN CUPCAKE SINGLE HOOK",1
914,84031A,"CHARLIE+LOLA RED HOT WATER BOTTLE ",1
915,84031B,"CHARLIE LOLA BLUE HOT WATER BOTTLE ",1
916,84032A,"CHARLIE+LOLA PINK HOT WATER BOTTLE",1
917,84086C,"PINK/PURPLE RETRO RADIO",1
918,84279P,"CHERRY BLOSSOM  DECORATIVE FLASK",1
919,85015,"SET OF 12  VINTAGE POSTCARD SET",1
920,85016,"SET OF 6 VINTAGE NOTELETS KIT",1
921,85017A,"ENVELOPE 50 ROMANTIC IMAGES",1
922,85017B,"ENVELOPE 50 BLOSSOM IMAGES",1
923,85032D,"YULETIDE IMAGES GIFT WRAP SET",1
924,85039A,"SET/4 RED MINI ROSE CANDLE IN BOWL",1
925,85048,"15CM CHRISTMAS GLASS BALL 20 LIGHTS",1
926,85064,"CREAM SWEETHEART LETTER RACK",1
927,85127,"SMALL SQUARE CUT GLASS CANDLESTICK",1
928,85129D,"BEADED CRYSTAL HEART PINK SMALL",1
929,85131B,"BEADED CRYSTAL HEART GREEN ON STICK",1
930,85132A,"CHARLIE + LOLA BISCUITS TINS",1
931,85135C,"RED DRAGONFLY HELICOPTER",1
932,85176,"SEWING SUSAN 21 NEEDLE SET",1
933,85177,"BASKET OF FLOWERS SEWING KIT",1
934,85178,"VICTORIAN SEWING KIT",1
935,85186A,"EASTER BUNNY GARLAND OF FLOWERS",1
936,85232B,"SET OF 3 BABUSHKA STACKING TINS",1
937,90003C,"MIDNIGHT BLUE PAIR HEART HAIR SLIDE",1
938,90018A,"SILVER M.O.P ORBIT DROP EARRINGS",1
939,90022,"EDWARDIAN DROP EARRINGS JET BLACK",1
940,90071,"RUBY GLASS CLUSTER EARRINGS",1
941,90099,"NECKLACE+BRACELET SET BLUE HIBISCUS",1
942,90116,"FRUIT SALAD BAG CHARM",1
943,90120C,"GREEN MURANO TWIST BRACELET",1
944,90129A,"PINK GLASS TASSLE BAG CHARM ",1
945,90129B,"TURQUOISE GLASS TASSLE BAG CHARM ",1
946,90161A,"ANT COPPER RED BOUDICCA BRACELET",1
947,90190C,"SILVER/AMETHYST DROP EARRINGS LEAF",1
948,90194,"SILVER LARIAT BLACK STONE EARRINGS",1
949,90209B,"GREEN ENAMEL+GLASS HAIR COMB",1
950,90214D,"LETTER "D"" BLING KEY RING"",1
951,90214G,"LETTER "G"" BLING KEY RING"",1
952,90214H,"LETTER "H"" BLING KEY RING"",1
953,90214J,"LETTER "J"" BLING KEY RING"",1
954,90214R,"LETTER "R"" BLING KEY RING"",1
955,DOT,"DOTCOM POSTAGE",1
956,84534B,"FAIRY CAKE NOTEBOOK A5 SIZE",1
957,84535B,"FAIRY CAKES NOTEBOOK A6 SIZE",1
958,84536A,"ENGLISH ROSE NOTEBOOK A7 SIZE",1
959,84536B,"FAIRY CAKES NOTEBOOK A7 SIZE",1
960,84580,"MOUSE TOY WITH PINK T-SHIRT",1
961,84581,"DOG TOY WITH PINK CROCHET SKIRT",1
962,84598,"BOYS ALPHABET IRON ON PATCHES",1
963,84912B,"GREEN ROSE WASHBAG",1
964,84913A,"SOFT PINK ROSE TOWEL ",1
965,84913B,"MINT GREEN ROSE TOWEL",1
966,84923,"PINK BUTTERFLY HANDBAG W BOBBLES",1
967,84946,"ANTIQUE SILVER TEA GLASS ETCHED",1
968,84988,"SET OF 72 PINK HEART PAPER DOILIES",1
969,20856,"DENIM PATCH PURSE PINK BUTTERFLY",1
970,20854,"BLUE PATCH PURSE PINK HEART",1
971,21218,"RED SPOTTY BISCUIT TIN",1
972,22845,"VINTAGE CREAM CAT FOOD CONTAINER",1
973,11001,"ASSTD DESIGN RACING CAR PEN",1
974,16236,"KITTY PENCIL ERASERS",1
975,17003,"BROCADE RING PURSE ",1
976,17011F,"ORIGAMI SANDLEWOOD INCENSE+FLOWER",1
977,17012A,"ORIGAMI VANILLA INCENSE/CANDLE SET ",1
978,17012B,"ORIGAMI JASMINE INCENSE/CANDLE SET",1
979,17012C,"ORIGAMI LAVENDER INCENSE/CANDL SET ",1
980,17012D,"ORIGAMI ROSE INCENSE/CANDLE SET ",1
981,17012E,"ORIGAMI OPIUM INCENSE/CANDLE SET ",1
982,17012F,"ORIGAMI SANDLEWOOD INCENSE/CAND SET",1
983,17129F,"BLUE GLASS GEMS IN BAG",1
984,18098C,"PORCELAIN BUTTERFLY OIL BURNER",1
985,20622,"VIPPASSPORT COVER ",1
986,20658,"RED RETROSPOT LUGGAGE TAG",1
987,20662,"FIRST CLASS HOLIDAY PURSE ",1
988,20676,"RED RETROSPOT BOWL",1
989,20684,"STRAWBERRY DREAM CHILDS UMBRELLA",1
990,20719,"WOODLAND CHARLOTTE BAG",1
991,20724,"RED RETROSPOT CHARLOTTE BAG",1
992,20733,"GOLD MINI TAPE MEASURE ",1
993,20735,"BLACK MINI TAPE MEASURE ",1
994,20770,"ABSTRACT CIRCLE JOURNAL ",1
995,20835,"FRENCH LATTICE CUSHION COVER ",1
996,20839,"FRENCH PAISLEY CUSHION COVER ",1
997,20840,"FRENCH FLORAL CUSHION COVER ",1
998,20956,"PORCELAIN T-LIGHT HOLDERS ASSORTED",1
999,20969,"RED FLORAL FELTCRAFT SHOULDER BAG",1
1000,20971,"PINK BLUE FELT CRAFT TRINKET BOX",1
1001,20975,"12 PENCILS SMALL TUBE RED RETROSPOT",1
1002,20981,"12 PENCILS TALL TUBE WOODLAND",1
1003,20996,"JAZZ HEARTS ADDRESS BOOK",1
1004,21000,"ROSE DU SUD COSMETICS BAG",1
1005,21012,"ANTIQUE ALL GLASS CANDLESTICK",1
1006,21069,"VINTAGE BILLBOARD TEA MUG",1
1007,21070,"VINTAGE BILLBOARD MUG ",1
1008,21147,"JINGLE BELLS TREE DECORATION",1
1009,21158,"MOODY GIRL DOOR HANGER ",1
1010,21165,"BEWARE OF THE CAT METAL SIGN ",1
1011,21174,"POTTERING IN THE SHED METAL SIGN",1
1012,21189,"WHITE HONEYCOMB PAPER GARLAND ",1
1013,21191,"LARGE WHITE HONEYCOMB PAPER BELL  ",1
1014,21195,"PINK  HONEYCOMB PAPER BALL ",1
1015,21207,"SKULL AND CROSSBONES  GARLAND ",1
1016,21216,"SET 3 RETROSPOT TEA,COFFEE,SUGAR",1
1017,21217,"RED RETROSPOT ROUND CAKE TINS",1
1018,21231,"SWEETHEART CERAMIC TRINKET BOX",1
1019,21238,"RED RETROSPOT CUP",1
1020,21249,"WOODLAND  HEIGHT CHART STICKERS ",1
1021,21262,"WHITE GOOSE FEATHER CHRISTMAS TREE ",1
1022,21313,"GLASS HEART T-LIGHT HOLDER ",1
1023,21349,"IVY HEART WREATH",1
1024,21352,"EUCALYPTUS & PINECONE  WREATH",1
1025,21354,"TOAST ITS - BEST MUM",1
1026,21365,"MIRRORED WALL ART STARS",1
1027,21366,"MIRRORED WALL ART PHOTO FRAMES",1
1028,21369,"MIRRORED WALL ART SPLODGES",1
1029,21372,"MIRRORED WALL ART TABLE LAMP",1
1030,21385,"IVORY HANGING DECORATION  HEART",1
1031,21407,"BROWN CHECK CAT DOORSTOP ",1
1032,21408,"SPOTTY PINK DUCK DOORSTOP",1
1033,21507,"ELEPHANT, BIRTHDAY CARD, ",1
1034,21563,"RED HEART SHAPE LOVE BUCKET ",1
1035,21564,"PINK  HEART SHAPE LOVE BUCKET ",1
1036,21634,"ASSORTED MINI MADRAS NOTEBOOK",1
1037,21641,"ASSORTED TUTTI FRUTTI KEYRING BALL",1
1038,21679,"SKULLS  STICKERS",1
1039,21703,"BAG 125g SWIRLY MARBLES",1
1040,21704,"BAG 250g SWIRLY MARBLES",1
1041,21721,"CANDY SHOP  STICKER SHEET",1
1042,21722,"SWEET PUDDING STICKER SHEET",1
1043,21758,"VINTAGE SHELLS PRINT",1
1044,21134,,1
1045,22145,,1
1046,37509,,1
1047,22892,"SET OF SALT AND PEPPER TOADSTOOLS",1
1048,22245,"HOOK, 1 HANGER ,MAGIC GARDEN",1
1049,20957,"PORCELAIN HANGING BELL SMALL",1
1050,85226A,,1
1051,85044,,1
1052,79144B,"PAINTED LIGHTBULB STAR+ MOON",1
1053,22482,"BLUE TEA TOWEL CLASSIC DESIGN",1
1054,21917,"SET 12 KIDS  WHITE CHALK STICKS",1
1055,20950,,1
1056,37461,,1
1057,84670,,1
1058,20697,"LITTLE GREEN MONSTER SOFT TOY",1
1059,22599,"CHRISTMAS MUSICAL ZINC STAR",1
1060,22597,"CHRISTMAS MUSICAL ZINC HEART ",1
1061,21495,"SKULLS AND CROSSBONES WRAP",1
1062,46000R,"POLYESTER FILLER PAD 45x30cm",1
1063,46000S,"POLYESTER FILLER PAD 40x40cm",1
1064,84920,"PINK FLOWER FABRIC PONY",1
1065,22953,"BIRTHDAY PARTY CORDON BARRIER TAPE",1
1066,84508A,"CAMOUFLAGE DESIGN TEDDY",1
1067,21670,"BLUE SPOT CERAMIC DRAWER KNOB",1
1068,22786,"CUSHION COVER PINK UNION JACK",1
1069,22212,"FOUR HOOK  WHITE LOVEBIRDS",1
1070,22678,"FRENCH BLUE METAL DOOR SIGN 3",1
1071,22686,"FRENCH BLUE METAL DOOR SIGN No",1
1072,84685,"BEACH HUT KEY CABINET",1
1073,20616,"CHERRY BLOSSOM PASSPORT COVER",1
1074,22753,"SMALL YELLOW BABUSHKA NOTEBOOK ",1
1075,79066K,"RETRO MOD TRAY",1
1076,22794,"SWEETHEART WIRE MAGAZINE RACK",1
1077,22592,"CARDHOLDER HOLLY WREATH METAL",1
1078,84352,"SILVER CHRISTMAS TREE BAUBLE STAND ",1
1079,22795,"SWEETHEART RECIPE BOOK STAND",1
1080,22278,"OVERNIGHT BAG VINTAGE ROSE PAISLEY",1
1081,22802,"FAUX FUR CHOCOLATE THROW",1
1082,84884A,"ANT WHITE WIRE HEART SPIRAL",1
1083,51014C,"FEATHER PEN,COAL BLACK",1
1084,51014L,"FEATHER PEN,LIGHT PINK",1
1085,51014A,"FEATHER PEN,HOT PINK",1
1086,22366,"DOORMAT AIRMAIL ",1
1087,48111,"DOORMAT 3 SMILEY CATS",1
1088,22846,"BREAD BIN DINER STYLE RED ",1
1089,22402,"MAGNETS PACK OF 4 VINTAGE COLLAGE",1
1090,22400,"MAGNETS PACK OF 4 HOME SWEET HOME",1
1091,22399,"MAGNETS PACK OF 4 CHILDHOOD MEMORY",1
1092,79302M,"ART LIGHTS,FUNK MONKEY",1
1093,37446,"MINI CAKE STAND WITH HANGING CAKES",1
1094,84509B,"SET OF 4 FAIRY CAKE PLACEMATS",1
1095,22313,"OFFICE MUG WARMER PINK",1
1096,21181,"PLEASE ONE PERSON METAL SIGN",1
1097,21818,"GLITTER CHRISTMAS HEART ",1
1098,21668,"RED STRIPE CERAMIC DRAWER KNOB",1
1099,21462,"NURSERY A,B,C PAINTED LETTERS",1
1100,22496,"SET OF 2 ROUND TINS DUTCH CHEESE",1
1101,84870C,"GREEN GEISHA GIRL ",1
1102,84870B,"BLUE GEISHA GIRL ",1
1103,22765,"NEWSPAPER STAND",1
1104,21351,"CINAMMON & ORANGE WREATH",1
1105,22581,"WOOD STOCKING CHRISTMAS SCANDISPOT",1
1106,22579,"WOODEN TREE CHRISTMAS SCANDINAVIAN",1
1107,22572,"ROCKING HORSE GREEN CHRISTMAS ",1
1108,22640,"SET OF 4 NAPKIN CHARMS 3 KEYS ",1
1109,22641,"SET OF 4 NAPKIN CHARMS INSTRUMENT",1
1110,22638,"SET OF 4 NAPKIN CHARMS CROWNS ",1
1111,22576,"SWALLOW WOODEN CHRISTMAS DECORATION",1
1112,21817,"GLITTER CHRISTMAS TREE",1
1113,21813,"GARLAND WITH STARS AND BELLS",1
1114,21808,"CHRISTMAS GARLAND STARS,TREES",1
1115,21014,"SWISS CHALET TREE DECORATION ",1
1116,21018,"BIRD BOX CHRISTMAS TREE DECORATION",1
1117,22946,"WOODEN ADVENT CALENDAR CREAM",1
1118,M,Manual,1
1119,22660,"DOORMAT I LOVE LONDON",1
1120,21761,"WOOD AND GLASS MEDICINE CABINET",1
1121,21781,"MA CAMPAGNE CUTLERY BOX",1
1122,22696,"WICKER WREATH LARGE",1
1123,84360,"TABLE LAMP WHITE SHADE WOOD BASE",1
1124,35954,"SMALL FOLKART STAR CHRISTMAS DEC",1
1125,84760S,"SMALL HANGING GLASS+ZINC LANTERN",1
1126,85045,"GREEN CHRISTMAS TREE STRING 20LIGHT",1
1127,35598B,"BLACK CHRISTMAS TREE 60CM",1
1128,22578,"WOODEN STAR CHRISTMAS SCANDINAVIAN",1
1129,22855,"FINE WICKER HEART ",1
1130,21864,"UNION JACK FLAG PASSPORT COVER ",1
1131,15056P,"EDWARDIAN PARASOL PINK",1
1132,85174,"S/4 CACTI CANDLES",1
1133,82615,"PINK MARSHMALLOW SCARF KNITTING KIT",1
1134,85038,"6 CHOCOLATE LOVE HEART T-LIGHTS",1
1135,22965,"3 TRADITIONAL COOKIE CUTTERS  SET",1
1136,22972,"CHILDRENS SPACEBOY MUG",1
1137,21374,"MIRRORED WALL ART SKULLS",1
1138,21509,"COWBOYS AND INDIANS BIRTHDAY CARD ",1
1139,22025,"RING OF ROSES BIRTHDAY CARD",1
1140,22725,"ALARM CLOCK BAKELIKE CHOCOLATE",1
1141,37448,"CERAMIC CAKE DESIGN SPOTTED MUG",1
1142,22421,"LIPSTICK PEN FUSCHIA",1
1143,84997A,"GREEN 3 PIECE POLKADOT CUTLERY SET",1
1144,21777,,1
1145,21136,"PAINTED METAL PEARS ASSORTED",1
1146,71477,"COLOUR GLASS. STAR T-LIGHT HOLDER",1
1147,22030,"SWALLOWS GREETING CARD",1
1148,90214M,"LETTER "M"" BLING KEY RING"",1
1149,90214V,"LETTER "V"" BLING KEY RING"",1
1150,90214S,"LETTER "S"" BLING KEY RING"",1
1151,21789,"KIDS RAIN MAC PINK",1
1152,21629,"SQUARE FLOOR CUSHION VINTAGE RED",1
1153,21850,"BLUE  DIAMANTE PEN IN GIFT BOX",1
1154,20978,"36 PENCILS TUBE SKULLS",1
1155,20768,"GREEN FERN JOURNAL ",1
1156,20780,"BLACK EAR MUFF HEADPHONES",1
1157,21398,"RED POLKADOT COFFEE  MUG",1
1158,21643,"ASSORTED TUTTI FRUTTI MIRROR",1
1159,21620,"SET OF 4 ROSE BOTANICAL CANDLES",1
1160,22260,"FELT EGG COSY BLUE RABBIT ",1
1161,22136,"LOVE HEART SOCK HANGER",1
1162,10135,"COLOURING PENCILS BROWN TUBE",1
1163,16168M,"FUNKY MONKEY GIFT BAG MEDIUM",1
1164,17014A,"ORIGAMI VANILLA INCENSE CONES",1
1165,17084N,"FAIRY DREAMS INCENSE ",1
1166,17084P,"DRAGONS BLOOD INCENSE",1
1167,20617,"FIRST CLASS PASSPORT COVER ",1
1168,20619,"TROPICAL PASSPORT COVER ",1
1169,20653,"CHERRY BLOSSOM LUGGAGE TAG",1
1170,20681,"PINK POLKADOT CHILDRENS UMBRELLA",1
1171,20682,"RED RETROSPOT CHILDRENS UMBRELLA",1
1172,20696,"FLORAL SOFT CAR TOY",1
1173,20699,"MOUSEY LONG LEGS SOFT TOY",1
1174,20700,"GREEN CAT FLORAL CUSHION COVER ",1
1175,20718,"RED RETROSPOT SHOPPER BAG",1
1176,20752,"BLUE POLKADOT WASHING UP GLOVES",1
1177,20761,"BLUE PAISLEY SKETCHBOOK",1
1178,20846,"ZINC HEART LATTICE T-LIGHT HOLDER",1
1179,20931,"BLUE POT PLANT CANDLE ",1
1180,21002,"ROSE DU SUD DRAWSTRING BAG",1
1181,21015,"DARK BIRD HOUSE TREE DECORATION",1
1182,21067,"VINTAGE RED TEATIME MUG",1
1183,21109,"LARGE CAKE TOWEL, CHOCOLATE SPOTS",1
1184,21110,"LARGE CAKE TOWEL PINK SPOTS",1
1185,21128,"GOLD FISHING GNOME",1
1186,21164,"HOME SWEET HOME METAL SIGN ",1
1187,21188,"3D HEARTS  HONEYCOMB PAPER GARLAND",1
1188,21208,"PASTEL COLOUR HONEYCOMB FAN",1
1189,21220,"SET/4 BADGES DOGS",1
1190,21272,"SALLE DE BAIN HOOK",1
1191,21279,"VINTAGE KITCHEN PRINT FRUITS",1
1192,21281,"VINTAGE KITCHEN PRINT SEAFOOD",1
1193,21288,"STRIPEY CHOCOLATE NESTING BOXES",1
1194,21356,"TOAST ITS - FAIRY FLOWER",1
1195,21439,"BASKET OF TOADSTOOLS",1
1196,21447,"12 IVORY ROSE PEG PLACE SETTINGS",1
1197,21537,"RED RETROSPOT PUDDING BOWL",1
1198,21547,"CERAMIC BIRDHOUSE CRESTED TIT SMALL",1
1199,21594,"Dr. Jam's Arouzer Stress Ball",1
1200,21638,"ASSORTED TUTTI FRUTTI NOTEBOOK",1
1201,21648,"ASSORTED TUTTI FRUTTI SMALL PURSE",1
1202,21656,"RIDGED GLASS POSY VASE ",1
1203,21671,"RED SPOT CERAMIC DRAWER KNOB",1
1204,21684,"SMALL MEDINA STAMPED METAL BOWL ",1
1205,21698,"MOCK LOBSTER FRIDGE MAGNET",1
1206,21700,"BIG DOUGHNUT FRIDGE MAGNETS",1
1207,21745,"GAOLERS KEYS DECORATIVE GARDEN ",1
1208,21775,"DECORATIVE FLORE BATHROOM BOTTLE",1
1209,21820,"GLITTER HEART GARLAND WITH BELLS ",1
1210,21830,"ASSORTED CREEPY CRAWLIES",1
1211,21846,"PINK DIAMANTE PEN IN GIFT BOX",1
1212,21868,"POTTING SHED TEA MUG",1
1213,21875,"KINGS CHOICE MUG",1
1214,21896,"POTTING SHED TWINE",1
1215,21899,"KEY FOB , GARAGE DESIGN",1
1216,21906,"PHARMACIE FIRST AID TIN",1
1217,21908,"CHOCOLATE THIS WAY METAL SIGN",1
1218,21974,"SET OF 36 PAISLEY FLOWER DOILIES",1
1219,22078,"RIBBON REEL LACE DESIGN ",1
1220,22084,"PAPER CHAIN KIT EMPIRE",1
1221,22091,"EMPIRE TISSUE BOX",1
1222,22124,"SET OF 2 TEA TOWELS PING MICROWAVE",1
1223,22165,"DIAMANTE HEART SHAPED WALL MIRROR, ",1
1224,22184,"CAKE STAND VICTORIAN FILIGREE LARGE",1
1225,22208,"WOOD STAMP SET THANK YOU",1
1226,22246,"MAGIC GARDEN FELT GARLAND ",1
1227,22283,"6 EGG HOUSE PAINTED WOOD",1
1228,22304,"COFFEE MUG BLUE PAISLEY DESIGN",1
1229,22308,"TEA COSY BLUE STRIPE",1
1230,22317,"FIVE CATS HANGING DECORATION",1
1231,22324,"BLUE POLKADOT KIDS BAG",1
1232,22325,"MOBILE VINTAGE HEARTS ",1
1233,22331,"WOODLAND PARTY BAG + STICKER SET",1
1234,22342,"HOME GARLAND PAINTED ZINC ",1
1235,22350,"ILLUSTRATED CAT BOWL ",1
1236,22393,"PAPERWEIGHT VINTAGE COLLAGE",1
1237,22405,"MONEY BOX POCKET MONEY DESIGN",1
