product_id,StockCode,Description,category_id
2483,37444B,"BLUE BREAKFAST CUP AND SAUCER ",1
2484,37333,"RETRO "TEA FOR ONE"" "",1
2485,20778,"GARDEN PATH NOTEBOOK ",1
2486,20758,"ABSTRACT CIRCLES POCKET BOOK",1
2487,20956,?,1
2488,37467,,1
2489,22319,"HAIRCLIPS FORTIES FABRIC ASSORTED",1
2490,22824,"3 TIER SWEETHEART GARDEN SHELF",1
2491,21132,"SILVER STANDING GNOME   ",1
2492,84818,"DANISH ROSE PHOTO FRAME",1
2493,84798A,"PINK FOXGLOVE ARTIIFCIAL FLOWER",1
2494,22230,"JIGSAW TREE WITH WATERING CAN",1
2495,90033,"IVORY SHELL HEART EARRINGS",1
2496,21357,,1
2497,84497,,1
2498,90042C,,1
2499,17091A,,1
2500,84773,,1
2501,85018C,,1
2502,20878,,1
2503,21186,,1
2504,62095B,,1
2505,72814,,1
2506,84802A,,1
2507,90002D,,1
2508,22218,,1
2509,84247C,,1
2510,90042B,,1
2511,84843,"WHITE SOAP RACK WITH 2 BOTTLES",1
2512,85032A,"ROMANTIC IMAGES GIFT WRAP SET",1
2513,85032C,"CURIOUS IMAGES GIFT WRAP SET",1
2514,21144,"PINK POODLE HANGING DECORATION ",1
2515,21317,"GLASS SPHERE CANDLE STAND MEDIUM",1
2516,72815,"3 WICK CHRISTMAS BRIAR CANDLE ",1
2517,84968e,"SET OF 16 VINTAGE BLACK CUTLERY",1
2518,22885,"NUMBER TILE VINTAGE FONT 6 ",1
2519,84660b,"BLACK STITCHED WALL CLOCK",1
2520,84356,"POMPOM CURTAIN",1
2521,47578A,"ENGLISH ROSE SMALL SCENTED FLOWER",1
2522,20892,,1
2523,21324,,1
2524,20956,,1
2525,46000S,"Dotcom sales",1
2526,46000M,"Dotcom sales",1
2527,21562,"HAWAIIAN GRASS SKIRT ",1
2528,22353,,1
2529,22856,"ASSORTED EASTER DECORATIONS  BELLS",1
2530,22934,"BAKING MOULD EASTER EGG WHITE CHOC",1
2531,16048,"TEATIME ROUND PENCIL SHARPENER ",1
2532,20932,"PINK POT PLANT CANDLE",1
2533,22263,"FELT EGG COSY LADYBIRD ",1
2534,46776F,"WOVEN ROSE GARDEN CUSHION COVER ",1
2535,84509E,"SET OF 4 CAROUSEL PLACEMATS ",1
2536,84510E,"SET OF 4 GREEN CAROUSEL COASTERS",1
2537,84748,"FOLK FELT HANGING MULTICOL GARLAND",1
2538,90070,"RUBY GLASS CLUSTER BRACELET",1
2539,90147,"CHUNKY SILVER NECKLACE PASTEL FLOWE",1
2540,90201C,"RED ENAMEL FLOWER RING",1
2541,37475,"SET/4 COLOURFUL MIXING BOWLS",1
2542,84951A,"SET OF 4 PISTACHIO LOVEBIRD COASTER",1
2543,84951B,"SET OF 4 BLACK LOVEBIRD COASTERS",1
2544,22053,"EMPIRE DESIGN ROSETTE",1
2545,21131,"GOLD STANDING GNOME",1
2546,20654,"FIRST CLASS LUGGAGE TAG ",1
2547,17165D,"ASS COL LARGE SAND FROG P'WEIGHT",1
2548,22291,"HANGING CHICK CREAM DECORATION",1
2549,15058A,"BLUE POLKADOT GARDEN PARASOL",1
2550,20868,"SILVER FABRIC MIRROR",1
2551,84820,"DANISH ROSE TRINKET TRAYS",1
2552,85006,"SET 4 NURSERY DES ROUND BOXES",1
2553,84821,"DANISH ROSE DELUXE COASTER",1
2554,84638,"SMALL KITCHEN FLOWER POTS PLAQUE",1
2555,22229,"BUNNY WOODEN PAINTED WITH FLOWER ",1
2556,22228,"BUNNY WOODEN PAINTED WITH BIRD ",1
2557,16169P,"WRAP GREEN RUSSIAN FOLKART ",1
2558,16054,"POPART RECT PENCIL SHARPENER ASST",1
2559,84595E,"LARGE TORTILLA DESIGN RED BOWL",1
2560,35915B,"BLUE KNITTED HEN ",1
2561,85086A,"CANDY SPOT HEART DECORATION",1
2562,21431,,1
2563,79067,,1
2564,85084,"HOLLY TOP CHRISTMAS STOCKING",1
2565,81950V,"FLOWER PURPLE CLOCK W/SUCKER",1
2566,85084,,1
2567,22055,"MINI CAKE STAND  HANGING STRAWBERY",1
2568,84631,"FRUIT TREE AND BIRDS WALL PLAQUE",1
2569,84799,"SPRIG LAVENDER ARTIFICIAL FLOWER",1
2570,35004P,"SET OF 3 PINK FLYING DUCKS",1
2571,21454,"PAINTED PINK RABBIT ",1
2572,15058B,"PINK POLKADOT GARDEN PARASOL",1
2573,22391,"PAPERWEIGHT HOME SWEET HOME",1
2574,21318,"GLASS CHALICE BLUE SMALL ",1
2575,21418,"STARFISH SOAP DISH",1
2576,21420,"OYSTER TRINKET BOX",1
2577,22286,"DECORATION , WOBBLY RABBIT , METAL ",1
2578,22287,"DECORATION , WOBBLY CHICKEN, METAL ",1
2579,35609A,"PINK FEATHER CHRISTMAS DECORATION",1
2580,35610C,"WHITE CHRISTMAS FLOCK DROPLET ",1
2581,46776D,"WOVEN SUNSET CUSHION COVER ",1
2582,84688,"BEACH HUT DESIGN BLACKBOARD",1
2583,84931A,"PINK SCOTTIE DOG W FLOWER PATTERN",1
2584,85211,"S/4 GROOVY CAT MAGNETS",1
2585,90031,"BILI NUT AND WOOD NECKLACE",1
2586,90040A,"MURANO STYLE GLASS BRACELET RED",1
2587,90125B,"AQUA BERTIE GLASS BEAD BAG CHARM",1
2588,90125D,"PURPLE BERTIE GLASS BEAD BAG CHARM",1
2589,DCGS0003,"BOXED GLASS ASHTRAY",1
2590,85230E,"STRAWBRY SCENTED VOTIVE CANDLE",1
2591,22826,"LOVE SEAT ANTIQUE WHITE METAL",1
2592,22852,"DOG BOWL VINTAGE CREAM",1
2593,22102,"MIRROR MOSAIC T-LIGHT HOLDER ",1
2594,35004P,,1
2595,16033,"MINI HIGHLIGHTER PENS",1
2596,20830,"SILVER PHOTO FRAME",1
2597,20831,"GOLD PHOTO FRAME",1
2598,90003D,"CRYSTAL PAIR HEART HAIR SLIDES",1
2599,90067A,"PINK VINTAGE VICTORIAN EARRINGS",1
2600,21378,"SMALL TALL CAMPHOR WOOD TOADSTOOL",1
2601,85032B,"BLOSSOM IMAGES GIFT WRAP SET",1
2602,22857,"ASSORTED EASTER GIFT TAGS",1
2603,22858,"EASTER TIN KEEPSAKE",1
2604,22861,"EASTER TIN CHICKS IN GARDEN",1
2605,22232,"JIGSAW TOADSTOOLS 3 PIECE",1
2606,20793,"BLUE TILED TRAY",1
2607,20664,"TROPICAL HOLIDAY PURSE ",1
2608,47593A,"CAROUSEL PONIES BABY BIB",1
2609,20670,"VIP HOLIDAY PURSE",1
2610,21946,"PARTY TIME DESIGN FLANNEL",1
2611,20666,"ECONOMY HOLIDAY PURSE",1
2612,82605,"OLD DOC RUSSEL METAL SIGN",1
2613,85136B,"BLUE SHARK HELICOPTER",1
2614,84882,"GREEN WIRE STANDING CANDLE HOLDER",1
2615,85031A,"ROMANTIC IMAGES SCRAP BOOK SET",1
2616,16216,"LETTER SHAPE PENCIL SHARPENER",1
2617,21248,"DOOR HANGER  MUM + DADS ROOM",1
2618,21736,"GOLD SCROLL GLASS T-LIGHT HOLDER",1
2619,84922,"PINK BUTTERFLY WASHBAG",1
2620,90036E,"FLOWER GLASS GARLD NECKL36"AMETHYST"",1
2621,90160A,"PURPLE BOUDICCA LARGE BRACELET",1
2622,90160B,"RED BOUDICCA LARGE BRACELET",1
2623,90160D,"PINK BOUDICCA LARGE BRACELET",1
2624,82011A,"BATHROOM SCALES, TROPICAL BEACH",1
2625,85183A,"CHARLIE & LOLA WASTEPAPER BIN BLUE",1
2626,21194,"PINK  HONEYCOMB PAPER FAN",1
2627,21972,"SET OF 36 DINOSAUR PAPER DOILIES",1
2628,22281,"EASTER TREE YELLOW BIRDS",1
2629,22887,"NUMBER TILE VINTAGE FONT 8",1
2630,84876B,"GREEN HEART COMPACT MIRROR",1
2631,90126A,"PINK BERTIE MOBILE PHONE CHARM",1
2632,90190B,"GOLD/AMBER DROP EARRINGS W LEAF",1
2633,35610B,"BLACK CHRISTMAS FLOCK DROPLET ",1
2634,84927E,"FLOWERS TILE HOOK",1
2635,84816,"DANISH ROSE BEDSIDE CABINET",1
2636,90120D,"WHITE MURANO TWIST BRACELET",1
2637,22289,"HANGING METAL CHICKEN DECORATION",1
2638,20704,"MR ROBOT SOFT TOY",1
2639,20818,"GOLD TEDDY BEAR",1
2640,21199,"PINK  HEART CONFETTI IN TUBE",1
2641,21293,"MIRRORED DOVE WALL DECORATION",1
2642,71495A,"CD WALL TIDY BLUE OFFICE",1
2643,84584,"PINK GINGHAM CAT WITH SCARF",1
2644,85179C,"PINK BITTY LIGHT CHAIN",1
2645,85188B,"PINK METAL SWINGING BUNNY",1
2646,90076,"MONTANA DIAMOND CLUSTER EARRINGS",1
2647,90164A,"PINK ROSEBUD PEARL BRACELET",1
2648,90164B,"WHITE  ROSEBUD PEARL BRACELET",1
2649,72780,"BLACK SILOUETTE CANDLE PLATE",1
2650,22954,"HEN PARTY CORDON BARRIER TAPE",1
2651,22047,"EMPIRE GIFT WRAP",1
2652,22214,"CANDLE PLATE LACE WHITE",1
2653,90162C,"ANT SILVER FUSCHIA BOUDICCA RING",1
2654,90078,"PINK/WHITE GLASS DEMI CHOKER",1
2655,90032,"IVORY SHELL HEART NECKLACE",1
2656,21331,"MOROCCAN BEATEN METAL DISH LARGE",1
2657,20848,"ZINC HEART LATTICE CHARGER SMALL",1
2658,20826,"SILVER APERITIF GLASS",1
2659,21145,"ANTIQUE GLASS PLACE SETTING",1
2660,22723,"SET OF 6 HERB TINS SKETCHBOOK",1
2661,22722,"SET OF 6 SPICE TINS PANTRY DESIGN",1
2662,22720,"SET OF 3 CAKE TINS PANTRY DESIGN ",1
2663,84575A,"PINK DOG CANNISTER",1
2664,84313C,"ORANGE TV TRAY TABLE ",1
2665,21473,"SWEETHEART CREAM STEEL TABLE RECT",1
2666,90210A,"GREY ACRYLIC FACETED BANGLE",1
2667,21109,"LARGE CAKE TOWEL CHOCOLATE SPOTS",1
2668,84823,"DANISH ROSE FOLDING CHAIR",1
2669,90057,"DIAMANTE RING ASSORTED IN BOX.",1
2670,90210D,"PURPLE ACRYLIC FACETED BANGLE",1
2671,22656,"VINTAGE BLUE KITCHEN CABINET",1
2672,22782,"SET 3 WICKER STORAGE BASKETS ",1
2673,84766,"SILVER ROCOCO CANDLE STICK",1
2674,20860,"GOLD COSMETICS BAG WITH BUTTERFLY",1
2675,84711B,"PINK OVAL SHAPE TRINKET BOX",1
2676,84817,"DANISH ROSE DECORATIVE PLATE",1
2677,35832,"WOOLLY HAT SOCK GLOVE ADVENT STRING",1
2678,22932,"BAKING MOULD TOFFEE CUP  CHOCOLATE",1
2679,22937,"BAKING MOULD CUPCAKE CHOCOLATE",1
2680,22721,"SET OF 3 CAKE TINS SKETCHBOOK",1
2681,22711,"WRAP CIRCUS PARADE",1
2682,22522,"CHILDS GARDEN FORK BLUE ",1
2683,22270,"HAPPY EASTER HANGING DECORATION",1
2684,85195,"HANGING HEART BASKET",1
2685,85194L,"HANGING SPRING FLOWER EGG LARGE",1
2686,84660A,"WHITE STITCHED WALL CLOCK",1
2687,75178,"ASSTD COL BUTTERFLY/CRYSTAL W/CHIME",1
2688,75011,"BLUE DAISY MOBILE",1
2689,47503A,"ASS FLORAL PRINT MULTI SCREWDRIVER",1
2690,22888,"NUMBER TILE VINTAGE FONT 9 ",1
2691,22886,"NUMBER TILE VINTAGE FONT 7",1
2692,22881,"NUMBER TILE VINTAGE FONT 2",1
2693,22879,"NUMBER TILE VINTAGE FONT 0",1
2694,21631,"HIPPY CHIC DECORATIVE PARASOL",1
2695,20705,"MRS ROBOT SOFT TOY",1
2696,90125A,"PINK BERTIE GLASS BEAD BAG CHARM",1
2697,85180A,"RED HEARTS LIGHT CHAIN ",1
2698,85159B,"WHITE TEA,COFFEE,SUGAR JARS",1
2699,22963,"JAM JAR WITH BLUE LID",1
2700,85135B,,1
2701,22204,"MILK PAN BLUE POLKADOT",1
2702,90058B,"CRYSTAL STUD EARRINGS ASSORTED COL ",1
2703,84597B,"RETRO BROWN BALL ASHTRAY ",1
2704,22444,,1
2705,84616,"SILVER ROCCOCO CHANDELIER",1
2706,84666,"SQUARE CHERRY BLOSSOM CABINET",1
2707,22734,"amazon sales",1
2708,22303,"COFFEE MUG APPLES DESIGN",1
2709,84796a,"PINK HAWAIIAN PICNIC HAMPER FOR 2",1
2710,20871,"OPULENT VELVET SET/3 CANDLES",1
2711,21160,"KEEP OUT GIRLS DOOR HANGER ",1
2712,21186,"WHITE DOVE HONEYCOMB PAPER GARLAND",1
2713,84673A,"PINK FLY SWAT",1
2714,37503,"TEA TIME CAKE STAND IN GIFT BOX",1
2715,21386,"IVORY HANGING DECORATION  EGG",1
2716,21895,,1
2717,90146,"FINE SILVER NECKLACE W PASTEL FLOWE",1
2718,22257,"FELT FARM ANIMAL SHEEP",1
2719,22258,"FELT FARM ANIMAL RABBIT",1
2720,22259,"FELT FARM ANIMAL HEN",1
2721,35817P,"ACRYLIC JEWEL SNOWFLAKE,PINK",1
2722,85141,"JARDIN ETCHED GLASS FRUITBOWL",1
2723,90042A,"FRESHWATER PEARL BRACELET GOLD",1
2724,90136,"PALE PINK/AMETHYST STONE NECKLACE",1
2725,90060B,"FIRE POLISHED GLASS NECKL GOLD",1
2726,90035A,"PEARL & SHELL 42"NECKL. GREEN"",1
2727,90133,"TEAL/FUSCHIA COL BEAD NECKLACE",1
2728,90179A,"AMBER FINE BEAD NECKLACE W TASSEL",1
2729,79329,"PINK FLOCK GLASS CANDLEHOLDER",1
2730,85146,"JARDIN ETCHED GLASS SMALL BELL JAR",1
2731,22033,"BOTANICAL ROSE GREETING CARD",1
2732,22032,"BOTANICAL LILY GREETING CARD",1
2733,84751B,"BLACK MEDIUM GLASS CAKE STAND",1
2734,84507B,"STRIPES DESIGN MONKEY DOLL",1
2735,84620,"BLUE GINGHAM ROSE CUSHION COVER",1
2736,84929,"ASSTD FRUIT+FLOWERS FRIDGE MAGNETS",1
2737,21707,"FOLDING UMBRELLA BLACKBLUE POLKADOT",1
2738,22868,"NUMBER TILE COTTAGE GARDEN 0 ",1
2739,22874,"NUMBER TILE COTTAGE GARDEN 6",1
2740,22872,"NUMBER TILE COTTAGE GARDEN 4",1
2741,22871,"NUMBER TILE COTTAGE GARDEN 3 ",1
2742,22302,"COFFEE MUG PEARS  DESIGN",1
2743,47594B,"SCOTTIES DESIGN WASHBAG",1
2744,21196,"ROUND WHITE CONFETTI IN TUBE",1
2745,22218,"CAKE STAND LACE WHITE",1
2746,22970,"LONDON BUS COFFEE MUG",1
2747,22062,"CERAMIC BOWL WITH LOVE HEART DESIGN",1
2748,22040,"BOTANICAL ROSE GIFT WRAP",1
2749,21348,"PINK SPOTS CHOCOLATE NESTING BOXES ",1
2750,22971,"QUEENS GUARD COFFEE MUG",1
2751,84877B,"GREEN ROUND COMPACT MIRROR",1
2752,84926F,"PSYCHEDELIC TILE COASTER",1
2753,21400,"RED PUDDING SPOON",1
2754,35911A,"MULTICOLOUR RABBIT EGG WARMER",1
2755,85031C,"CURIOUS IMAGES SCRAP BOOK SET",1
2756,84613A,"PINK NEW BAROQUE FLOCK CANDLESTICK",1
2757,90012B,"BLACK DROP CRYSTAL NECKLACE",1
2758,21043,"APRON MODERN VINTAGE COTTON",1
2759,37342,"POLKADOT COFFEE CUP & SAUCER PINK",1
2760,84750B,"BLACK SMALL GLASS CAKE STAND",1
2761,21425,"SKULLS STORAGE BOX LARGE",1
2762,72800C,"4 PINK DINNER CANDLE SILVER FLOCK",1
2763,35810A,"ENAMEL PINK COFFEE CONTAINER",1
2764,21491,"SET OF THREE VINTAGE GIFT WRAPS",1
2765,21633,"SUNFLOWER DECORATIVE PARASOL",1
2766,35607A,"PINK FLUFFY CHRISTMAS DECORATION",1
2767,22410,"MONEY BOX HOUSEKEEPING DESIGN",1
2768,84859A,"SILVER DISCO HANDBAG",1
2769,85103,"SILVER T-LIGHT SETTING",1
2770,85031B,"BLOSSOM IMAGES SCRAP BOOK SET",1
2771,22249,"DECORATION WHITE CHICK MAGIC GARDEN",1
2772,22407,"MONEY BOX FIRST ADE DESIGN",1
2773,85205B,"PINK FELT EASTER RABBIT GARLAND",1
2774,22929,"SCHOOL DESK AND CHAIR ",1
2775,85163A,"WHITE BAROQUE WALL CLOCK ",1
2776,85163B,"BLACK BAROQUE WALL CLOCK ",1
2777,85088,"CANDY SPOT HAND BAG",1
2778,90201A,"PURPLE ENAMEL FLOWER RING",1
2779,90202A,"PURPLE ENAMEL FLOWER HAIR TIE",1
2780,90206A,"GOLD DIAMANTE STAR BROOCH",1
2781,22285,"HANGING HEN ON NEST DECORATION",1
2782,84600,"NEW BAROQUE JEWELLERY BOX ",1
2783,84857C,"PINK MONTE CARLO HANDBAG",1
2784,90144,"SILVER DROP EARRINGS WITH FLOWER",1
2785,90165B,"WHITE ROSEBUD  PEARL EARRINGS",1
2786,20694,"FLORAL PINK MONSTER",1
2787,20869,"GOLD FABRIC MIRROR",1
2788,20954,"*USB Office Mirror Ball",1
2789,21455,"PAINTED YELLOW WOODEN DAISY",1
2790,22206,"MUG , DOTCOMGIFTSHOP.COM ",1
2791,35933,"PINK STOCKING CHRISTMAS DECORATION",1
2792,85232A,"SET/3 POLKADOT STACKING TINS",1
2793,90027B,"GLASS BEAD HOOP EARRINGS MONTANA",1
2794,90122A,"PINK CRYSTAL+GLASS BRACELET",1
2795,90197B,"BLACK GLASS BRACELET W HEART CHARMS",1
2796,72225C,"LAVENDER SCENT CAKE CANDLE",1
2797,46000U,"POLYESTER FILLER PAD 30CMx30CM",1
2798,90072,"RUBY DROP CHANDELIER EARRINGS",1
2799,90214T,"LETTER "T"" BLING KEY RING"",1
2800,20934,"SET/3 POT PLANT CANDLES",1
2801,21402,"RED  EGG  SPOON",1
2802,22135,"MINI LADLE LOVE HEART PINK",1
2803,47585A,"PINK FAIRY CAKE CUSHION COVER",1
2804,90011D,"PURPLE CRYSTAL DROP EARRINGS",1
2805,90012A,"MIDNIGHT BLUE DROP CRYSTAL NECKLACE",1
2806,90042C,"FRESHWATER PEARL BRACELET IVORY",1
2807,90141C,"TURQ PENDANT TRIPLE SHELL NECKLACE",1
2808,90142A,"GREEN PENDANT SHELL NECKLACE",1
2809,90165A,"PINK ROSEBUD PEARL EARRINGS",1
2810,90177B,"DROP DIAMANTE EARRINGS BLACK DIAMON",1
2811,90202D,"PINK ENAMEL FLOWER HAIR TIE",1
2812,90154,"LAZER CUT NECKLACE W PASTEL BEADS",1
2813,90199D,"5 STRAND GLASS NECKLACE AMBER",1
2814,90014A,"SILVER/MOP ORBIT NECKLACE",1
2815,90178B,"PURPLE CHUNKY GLASS+BEAD NECKLACE",1
2816,21009,"ETCHED GLASS STAR TREE DECORATION",1
2817,21793,"CLASSIC FRENCH STYLE BASKET BROWN",1
2818,85023B,"EAU DE NILE JEWELLED PHOTOFRAME",1
2819,85109,"PINK BOUDOIR T-LIGHT HOLDER",1
2820,84804A,"CREAM DELPHINIUM ARTIFICIAL FLOWER",1
2821,84800L,"LARGE WHITE/PINK ROSE ART FLOWER",1
2822,84800M,"MEDIUM WHITE/PINK ROSE ART FLOWER",1
2823,84802A,"WHITE ANEMONE ARTIFICIAL FLOWER",1
2824,84806A,"PINK CANDYSTUFT ARTIFICIAL FLOWER",1
2825,22707,"WRAP MONSTER FUN ",1
2826,21503,"TOYBOX  WRAP ",1
2827,90108,"BLUE BLOSSOM HAIR CLIP",1
2828,16207A,"PINK STRAWBERRY HANDBAG ",1
2829,21747,"SMALL SKULL WINDMILL",1
2830,84457,"SET/3 RABBITS FLOWER SKIPPPING ROPE",1
2831,84249A,"GREETING CARD,SQUARE, DOUGHNUTS",1
2832,22837,"HOT WATER BOTTLE BABUSHKA LARGE",1
2833,22953,"BIRTHDAY BANNER TAPE",1
2834,22148,"EASTER CRAFT 4 CHICKS ",1
2835,90011B,"BLACK CRYSTAL DROP EARRINGS",1
2836,90055,"CRACKED GLAZE EARRINGS BROWN",1
2837,90142D,"MOP PENDANT SHELL NECKLACE",1
2838,90176B,"DIAMANTE NECKLACE BLACK ",1
2839,gift_0001_40,"Dotcomgiftshop Gift Voucher 40.00",1
2840,21479,?,1
2841,22591,,1
2842,21198,"WHITE HEART CONFETTI IN TUBE",1
2843,90027D,"GLASS BEAD HOOP EARRINGS AMETHYST",1
2844,71477,,1
2845,35400,,1
2846,21491,,1
2847,21009,,1
2848,44228,"CANNABIS LEAF BEAD CURTAIN",1
2849,85230A,"OPIUM SCENTED VOTIVE CANDLE",1
2850,79191D,"RETRO PLASTIC DAISY TRAY",1
2851,85135B,Found,1
2852,22066,"LOVE HEART TRINKET POT",1
2853,35819B,"ACRYLIC HANGING JEWEL,BLUE",1
2854,84199,"GLOW IN DARK DOLPHINS",1
2855,82613A,"METAL SIGN,CUPCAKE SINGLE HOOK",1
2856,85135A,"YELLOW DRAGONFLY HELICOPTER",1
2857,22823,"CHEST NATURAL WOOD 20 DRAWERS",1
2858,DCGS0070,"CAMOUFLAGE DOG COLLAR",1
2859,15044A,"PINK PAPER PARASOL ",1
2860,85160a,"WHITE BIRD GARDEN DESIGN MUG",1
2861,85126,"LARGE ROUND CUTGLASS CANDLESTICK",1
2862,47518f,"ICON PLACEMAT POP ART ELVIS",1
2863,22734,,1
2864,84499,"BLACK FLOWER CANDLE PLATE",1
2865,16045,"POPART WOODEN PENCILS ASST",1
2866,21394,"RED POLKADOT BEAKER ",1
2867,22046,"TEA PARTY  WRAPPING PAPER ",1
2868,84931B,"BLUE SCOTTIE DOG W FLOWER PATTERN",1
2869,21270,"ANTIQUE CREAM CUTLERY CUPBOARD",1
2870,22134,"MINI LADLE LOVE HEART RED ",1
2871,85161,"ACRYLIC GEOMETRIC LAMP",1
2872,90011A,"MIDNIGHT BLUE CRYSTAL DROP EARRINGS",1
2873,90013D,"PURPLE VINTAGE EARRINGS",1
2874,90024E,"NEW BAROQUE B'FLY NECKLACE MONTANA",1
2875,90024F,"NEW BAROQUE B'FLY NECKLACE CRYSTAL",1
2876,90103,"PURPLE FRANGIPANI NECKLACE",1
2877,90152A,"SILVER/NAT SHELL NECKLACE W PENDANT",1
2878,90205C,"LARGE CRYSTAL DIAMANTE HAIRSLIDE",1
2879,22247,"BUNNY DECORATION MAGIC GARDEN",1
2880,gift_0001_50,"Dotcomgiftshop Gift Voucher 50.00",1
2881,84251C,"GREETING CARD, TWO SISTERS.",1
2882,35001W,,1
2883,16206B,"RED PURSE WITH PINK HEART",1
2884,46138B,"BLUE CHENILLE SHAGGY CUSHION COVER ",1
2885,20701,"PINK CAT FLORAL CUSHION COVER ",1
2886,90112,"PINK DOLLY HAIR CLIPS",1
2887,35443,"RASTA IN BATH W SPLIFF ASHTRAY",1
2888,22830,,1
2889,85064,,1
2890,21784,,1
2891,84689,,1
2892,84675,,1
2893,84499,,1
2894,85230F,,1
2895,22158,,1
2896,22501,"reverse 21/5/10 adjustment",1
2897,22501,,1
2898,22502,"reverse 21/5/10 adjustment",1
2899,21661,"VINTAGE GLASS TEA CADDY",1
2900,90112,,1
2901,90125E,"AMBER BERTIE GLASS BEAD BAG CHARM",1
2902,85168B,"BLACK BAROQUE CARRIAGE CLOCK",1
2903,85186C,"BUNNY EGG GARLAND",1
2904,84926E,"FLOWERS TILE COASTER",1
2905,85144,"JARDIN ETCHED GLASS CHEESE DISH",1
2906,22837,?,1
2907,84218,"BOX/12 CHICK & EGG IN BASKET",1
2908,85194S,"HANGING SPRING FLOWER EGG SMALL",1
2909,22865,,1
2910,22268,"EASTER DECORATION SITTING BUNNY",1
2911,90037B,"TINY CRYSTAL BRACELET GREEN",1
2912,90041,"PEARL AND CHERRY QUARTZ BRACLET",1
2913,90125C,"TURQUOISE BERTIE GLASS BEAD CHARM",1
2914,90163A,"PINK ROSEBUD & PEARL NECKLACE",1
2915,90163B,"WHITE ROSEBUD & PEARL NECKLACE",1
2916,21412,"VINTAGE GOLD TINSEL REEL",1
2917,35911B,"PINK/FLOWER RABBIT EGG WARMER ",1
2918,79071B,"ENGLISH ROSE METAL WASTE BIN",1
2919,16169M,"WRAP DAISY CARPET ",1
2920,22709,"WRAP WEDDING DAY",1
2921,gift_0001_30,"Dotcomgiftshop Gift Voucher 30.00",1
2922,gift_0001_20,"Dotcomgiftshop Gift Voucher 20.00",1
2923,35957,,1
2924,79320,"FLAMINGO LIGHTS",1
2925,85042,"ANTIQUE LILY FAIRY LIGHTS",1
2926,20785,"FUSCHIA RETRO BAR STOOL",1
2927,85089,"CANDY SPOT BUNNY",1
2928,35909A,"RABBIT EASTER DECORATION",1
2929,35910A,"MULTICOLOUR EASTER RABBIT ",1
2930,21763,"VINTAGE WOODEN BAR STOOL",1
2931,20933,"YELLOW POT PLANT CANDLE",1
2932,35972,"DAISY FOLKART HEART DECORATION",1
2933,22198,,1
2934,90155,"RESIN NECKLACE W PASTEL BEADS",1
2935,90096,,1
2936,47589,"CONGRATULATIONS BUNTING",1
2937,79323B,"BLACK CHERRY LIGHTS",1
2938,21645,"ASSORTED TUTTI FRUTTI ROUND BOX",1
2939,84661A,"WHITE SQUARE TABLE CLOCK",1
2940,90118,"PINK DAISY BAG CHARM",1
2941,90182C,"BLACK 3 BEAD DROP EARRINGS",1
2942,21278,"VINTAGE KITCHEN PRINT PUDDINGS",1
2943,47591D,,1
2944,16156L,"WRAP, CAROUSEL",1
2945,47351B,"BLUE  VOILE LAMPSHADE",1
2946,21084,"SET/6 COLLAGE PAPER CUPS",1
2947,21088,"SET/6 FRUIT SALAD PAPER CUPS",1
2948,21096,"SET/6 FRUIT SALAD  PAPER PLATES",1
2949,90119,"METALIC LEAVES BAG CHARMS",1
2950,84741C,"CITRUS GARLAND FELT FLOWERS ",1
2951,22266,"EASTER DECORATION HANGING BUNNY",1
2952,22267,"EASTER DECORATION EGG BUNNY ",1
2953,21003,"ROSE DU SUD CUSHION COVER",1
2954,21757,"LIGHTHOUSE PRINTED METAL SIGN",1
2955,90123B,"TURQUOISE HEART OF GLASS BRACELET",1
2956,90123C,"GREEN HEART OF GLASS BRACELET",1
2957,90122C,"TURQUOISE CRYSTAL+GLASS BRACELET",1
2958,90156,"RESIN BRACELET W PASTEL BEADS",1
2959,85023C,"PINK LARGE JEWELED PHOTOFRAME",1
2960,84617,"NEW BAROQUE BLACK BOXES",1
2961,21332,"MOROCCAN BEATEN METAL MIRROR",1
2962,21587,,1
2963,35923,"CANDY HEART HANGING DECORATION",1
2964,84661C,"PINK SQUARE TABLE CLOCK",1
2965,90038B,"GLASS AND PAINTED BEADS BRACELET OL",1
2966,90137,"PINK COMBO MINI CRYSTALS NECKLACE",1
2967,21258,?,1
2968,21589,,1
2969,22617,"mouldy, thrown away.",1
2970,21655,"HANGING RIDGE GLASS T-LIGHT HOLDER",1
2971,79323P,"PINK CHERRY LIGHTS",1
2972,21275,,1
2973,72038P,damages,1
2974,90181A,"AMBER GLASS/SHELL/PEARL NECKLACE",1
2975,90214W,"LETTER "W"" BLING KEY RING"",1
2976,90059F,"DIAMANTE HAIR GRIP PACK/2 LT ROSE",1
2977,44091A,"BLUE CRUSOE CHECK LAMPSHADE",1
2978,85124C,,1
2979,82599,?,1
2980,21280,"VINTAGE KITCHEN PRINT VEGETABLES",1
2981,21644,found,1
2982,22837,Found,1
2983,20748,Found,1
2984,21667,,1
2985,90037C,"TINY CRYSTAL BRACELET BLUE",1
2986,90122B,"JADE CRYSTAL+GLASS BRACELET",1
2987,35915C,"PEACH KNITTED HEN ",1
2988,84546,,1
2989,35271S,,1
2990,82605,,1
2991,POST,,1
2992,84029E,,1
2993,85197,"SET OF 12 MINI BUNNIES IN A BUCKET",1
2994,85019B,"BLOSSOM  IMAGES NOTEBOOK SET",1
2995,16207B,"PINK HEART RED HANDBAG",1
2996,20698,"LITTLE PINK MONSTER SOFT TOY",1
2997,47556B,"TEA TIME TEA TOWELS ",1
2998,35265,"COLOURFUL FLOWER FRUIT BOWL",1
2999,16162L,"THE KING GIFT BAG",1
3000,90092,"BLUE CRYSTAL BOOT PHONE CHARM",1
3001,90190A,"SILVER/CRYSTAL DROP EARRINGS W LEAF",1
3002,90011E,"AMBER CRYSTAL DROP EARRINGS",1
3003,90038A,"GLASS AND PAINTED BEADS BRACELET TO",1
3004,90079,"VINTAGE ENAMEL & CRYSTAL NECKLACE",1
3005,21667,"GLASS CAKE COVER AND PLATE",1
3006,22323,"PINK POLKADOT KIDS BAG",1
3007,22103,"MIRROR MOSAIC T-LIGHT HOLDER ROUND",1
3008,90141D,"ROSE PENDANT TRIPLE SHELL NECKLACE",1
3009,85160B,"BLACK BIRD GARDEN DESIGN MUG",1
3010,84050,counted,1
3011,23231,"WRAP DOILEY DESIGN",1
3012,22323,,1
3013,17011A,,1
3014,62086A,"PINK RETRO BIG FLOWER BAG",1
3015,90039A,"FIRE POLISHED GLASS BRACELET RED",1
3016,21371,"MIRRORED WALL ART POPPIES",1
3017,21632,,1
3018,35912B,"WHITE/PINK CHICK DECORATION",1
3019,23230,"WRAP ALPHABET DESIGN",1
3020,85206B,"PINK FELT EASTER EGG BASKET",1
3021,85189,"HANGING BUTTERFLY  EGG",1
3022,84745A,"PINK HANGING GINGHAM EASTER HEN",1
3023,84745B,"BLUE HANGING GINGHAM EASTER HEN",1
3024,90130D,"RED STONE/CRYSTAL EARRINGS",1
3025,21117,"BLOND DOLL DOORSTOP",1
3026,21459,"YELLOW EASTER EGG HUNT START POST",1
3027,21460,"GREEN EASTER EGG HUNT START POST",1
3028,37468,"HARDMAN MUG 3 ASSORTED",1
3029,21897,"POTTING SHED CANDLE CITRONELLA",1
3030,72369A,"PINK CLEAR GLASS CANDLE PLATE",1
3031,22967,"SET 3 SONG BIRD PAPER EGGS ASSORTED",1
3032,22957,"SET 3 PAPER VINTAGE CHICK PAPER EGG",1
3033,22896,"PEG BAG APPLE DESIGN",1
3034,22199,"FRYING PAN RED POLKADOT ",1
3035,20914,"SET/5 RED SPOTTY LID GLASS BOWLS",1
3036,20725,"LUNCH BAG RED SPOTTY",1
3037,21082,"SET/20 FRUIT SALAD PAPER NAPKINS ",1
3038,21368,"MIRRORED WALL ART LADIES",1
3039,17174,"ASSTD RASTA KEY-CHAINS",1
3040,23233,"WRAP POPPIES  DESIGN",1
3041,35921,"EASTER BUNNY HANGING GARLAND",1
3042,85200,"BUNNY EGG BOX",1
3043,84231,"EASTER BUNNY WITH BASKET ON BACK",1
3044,21461,"BLUE EASTER EGG HUNT START POST",1
3045,84462,"3 PINK HEN+CHICKS IN BASKET",1
3046,84461,"12 PINK HEN+CHICKS IN BASKET",1
3047,35922,"EASTER BUNNY WREATH",1
3048,84675,"FROG KING WATERING CAN",1
3049,47469,"ASSORTED SHAPES PHOTO CLIP SILVER ",1
3050,23232,"WRAP VINTAGE PETALS  DESIGN",1
3051,84905,"PINK BUTTERFLY CUSHION COVER ",1
3052,84806B,"WHITE CANDYSTUFT ARTIFICIAL FLOWER",1
3053,21458,"2 PICTURE BOOK EGGS EASTER BUNNY",1
3054,85198,"ASSORTED FARMYARD ANIMALS IN BUCKET",1
3055,90191,"SILVER LARIAT 40CM",1
3056,84796B,"BLUE SAVANNAH PICNIC HAMPER FOR 2",1
3057,23166,"MEDIUM CERAMIC TOP STORAGE JAR",1
3058,22837,,1
3059,20845,"ZINC HEART LATTICE 2 WALL PLANTER",1
3060,84033,"FLAG OF ST GEORGE ",1
3061,85118,,1
3062,20795,"LARGE BLUE PROVENCAL CERAMIC BALL",1
3063,84226,"HEN HOUSE W FAMILY IN BARN & NEST",1
3064,79323W,"WHITE CHERRY LIGHTS",1
3065,21926,"RED/CREAM STRIPE CUSHION COVER ",1
3066,37379A,"PINK CHERRY BLOSSOM CUP & SAUCER",1
3067,35920,"FOUR RABBIT EASTER DECORATIONS",1
3068,22866,,1
3069,22632,,1
3070,84801A,"PINK HYDRANGEA ART FLOWER",1
3071,84592,"CROCHET ROSE PURSE WITH SUEDE BACK",1
3072,84800S,"SMALL WHITE/PINK ROSE ART FLOWER",1
3073,79192A,"RETRO PLASTIC 70'S TRAY",1
3074,85130C,"BEADED CRYSTAL HEART BLUE  LARGE",1
3075,20756,"GREEN FERN POCKET BOOK",1
3076,22351,"Given away",1
3077,46000S,Dotcom,1
3078,21112,"SWISS ROLL TOWEL PINK  SPOTS",1
3079,21320,"GLASS CHALICE GREEN  LARGE ",1
3080,90027C,"GLASS BEAD HOOP EARRINGS GREEN",1
3081,90202B,"WHITE ENAMEL FLOWER HAIR TIE",1
3082,22451,,1
3083,20854,,1
3084,22125,"UNION JACK HOT WATER BOTTLE ",1
3085,40046A,"RED DAISY PAPER LAMPSHADE",1
3086,85188A,"GREEN METAL SWINGING BUNNY",1
3087,84527,"FLAMES SUNGLASSES PINK LENSES",1
3088,72799C,"PINK PILLAR CANDLE SILVER FLOCK",1
3089,71101E,"STANDING FAIRY POLE SUPPORT ",1
3090,21457,"2 PICTURE BOOK EGGS EASTER DUCKS",1
3091,21456,"2 PICTURE BOOK EGGS EASTER CHICKS",1
3092,35647,"VINTAGE BEAD PINK SHADE ",1
3093,48185,?,1
3094,84823,,1
3095,84632,"DECORATIVE HANGING SHELVING UNIT",1
3096,22597,"MUSICAL ZINC HEART DECORATION ",1
3097,22764,"RUSTIC WOODEN CABINET, GLASS DOORS",1
3098,90037A,"TINY CRYSTAL BRACELET RED",1
3099,35913B,"WHITE/PINK CHICK EASTER DECORATION",1
3100,22146,"EASTER CRAFT IVY WREATH WITH CHICK",1
3101,21476,"STEEL SWEETHEART ROUND TABLE CREAM",1
3102,37351,"ORANGE FLOWER MUG ",1
3103,21348,,1
3104,85096,"label mix up",1
3105,22595,"GINGHAM HEART DECORATION",1
3106,21344,"MOROCCAN BEATEN METAL DISH",1
3107,84974,"S/2 ZINC HEART DESIGN PLANTERS",1
3108,22602,"RETROSPOT WOODEN HEART DECORATION",1
3109,72821,"CUPID SCENTED CANDLE IN GLASS",1
3110,22596,"CHRISTMAS STAR WISH LIST CHALKBOARD",1
3111,85161,samples/damages,1
3112,20699,,1
3113,21897,,1
3114,82583,,1
3115,85188B,,1
3116,84279B,,1
3117,35922,,1
3118,84917,,1
3119,84455,,1
3120,84227,,1
3121,84452,,1
3122,22146,,1
3123,90123D,"WHITE HEART OF GLASS BRACELET",1
3124,90123A,"PINK HEART OF GLASS BRACELET",1
3125,90148,"LONG SILVER NECKLACE PASTEL FLOWER",1
3126,90016B,"GOLD/M.O.P PENDANT ORBIT NECKLACE",1
3127,90016A,"SILVER/M.O.P PENDANT ORBIT NECKLACE",1
3128,84847,"FLORAL BATHROOM SET",1
3129,20898,"VINTAGE NOTEBOOK TRAVELOGUE",1
3130,84967A,,1
3131,84967B,,1
3132,84966B,,1
3133,84966A,,1
3134,37413,,1
3135,79063D,,1
3136,20798,,1
3137,85049B,,1
3138,75013B,,1
3139,35607A,,1
3140,22184,,1
3141,DCGS0055,,1
3142,DCGS0072,,1
3143,DCGS0074,,1
3144,90183C,"BLACK DROP EARRINGS W LONG BEADS",1
3145,DCGS0069,"OOH LA LA DOGS COLLAR",1
3146,17165D,,1
3147,20734,,1
3148,20864,,1
3149,20910,,1
3150,21282,,1
3151,21645,,1
